number,title,state,html_url,user,labels,assignee,comments,created_at,updated_at,closed_at,milestone,is_pull_request,body
1756,BorrowTree inconsistency when closing and opening document,closed,https://github.com/GraphiteEditor/Graphite/issues/1756,adamgerhant,Graphene,0HyperCube,0,2024-05-20T22:03:43Z,2025-01-19T22:00:06Z,2024-05-26T04:35:54Z,Milestone 37,No,"When closing a newly created blank document and then creating another new document, the `BorrowTree` in the `DynamicExecutor` is not the same as the first, even though both node networks are the same.  Blocks #1750     How to reproduce:  - Refresh on new document screen  - Create new document  - Close document  - Create another new document  https://github.com/GraphiteEditor/Graphite/assets/116332429/01dcb127-2a7c-444e-8cea-21d73ad1bb8e    ## Borrow tree from new document after refreshing (Artboard node id 17505474457066797865)  ```  tree.inputs_source_map(): [(Source { node: [], index: 0 }, (NodeId(1776386397), 2)), (Source { node: [NodeId(0)], index: 0 }, (NodeId(209454463), 1)), (Source { node: [NodeId(0), NodeId(0)], index: 0 }, (NodeId(209454463), 0)), (Source { node: [NodeId(0), NodeId(1)], index: 0 }, (NodeId(1553787294), 0)), (Source { node: [NodeId(0), NodeId(2)], index: 0 }, (NodeId(766666474), 1)), (Source { node: [NodeId(0), NodeId(3)], index: 0 }, (NodeId(209454463), 0)), (Source { node: [NodeId(0), NodeId(3)], index: 1 }, (NodeId(209454463), 2)), (Source { node: [NodeId(17505474457066797865)], index: 1 }, (NodeId(2719152001), 1)), (Source { node: [NodeId(17505474457066797865)], index: 2 }, (NodeId(2719152001), 5)), (Source { node: [NodeId(17505474457066797865)], index: 0 }, (NodeId(2290264875), 2)), (Source { node: [NodeId(17505474457066797865), NodeId(0)], index: 0 }, (NodeId(2719152001), 5)), (Source { node: [NodeId(17505474457066797865), NodeId(1)], index: 0 }, (NodeId(4128425038), 1)), (Source { node: [NodeId(17505474457066797865), NodeId(2)], index: 1 }, (NodeId(2290264875), 2)), (Source { node: [NodeId(17505474457066797865), NodeId(2)], index: 0 }, (NodeId(2290264875), 1)), (Source { node: [NodeId(17505474457066797865), NodeId(536129167933390016)], index: 0 }, (NodeId(1627101688), 0)), (Source { node: [NodeId(17505474457066797865), NodeId(536129167933390016)], index: 1 }, (NodeId(1627101688), 1)), (Source { node: [NodeId(17505474457066797865), NodeId(6416337593867558447)], index: 0 }, (NodeId(165319789), 0)), (Source { node: [NodeId(17505474457066797865), NodeId(6416337593867558447)], index: 1 }, (NodeId(165319789), 1)), (Source { node: [NodeId(17505474457066797865), NodeId(6825362522106989504)], index: 0 }, (NodeId(4255178570), 0)), (Source { node: [NodeId(17505474457066797865), NodeId(6825362522106989504)], index: 1 }, (NodeId(4255178570), 1)), (Source { node: [NodeId(17505474457066797865), NodeId(7832534103926174319)], index: 0 }, (NodeId(2542087029), 0)), (Source { node: [NodeId(17505474457066797865), NodeId(7832534103926174319)], index: 1 }, (NodeId(2542087029), 1)), (Source { node: [NodeId(17505474457066797865), NodeId(8298558591740644999)], index: 1 }, (NodeId(1175147230), 1)), (Source { node: [NodeId(17505474457066797865), NodeId(8298558591740644999)], index: 0 }, (NodeId(1175147230), 0)), (Source { node: [NodeId(17505474457066797865), NodeId(12089252423572272489)], index: 1 }, (NodeId(2801556587), 1)), (Source { node: [NodeId(17505474457066797865), NodeId(12089252423572272489)], index: 0 }, (NodeId(2801556587), 0))]  ```    ## Borrow tree after refreshing (Artboard node id 648511539128895861)  ```  tree.inputs_source_map(): [(Source { node: [], index: 0 }, (NodeId(187226068), 2)), (Source { node: [NodeId(0)], index: 0 }, (NodeId(2443952850), 1)), (Source { node: [NodeId(0), NodeId(0)], index: 0 }, (NodeId(2443952850), 0)), (Source { node: [NodeId(0), NodeId(1)], index: 0 }, (NodeId(1553787294), 0)), (Source { node: [NodeId(0), NodeId(2)], index: 0 }, (NodeId(766666474), 1)), (Source { node: [NodeId(0), NodeId(3)], index: 0 }, (NodeId(2443952850), 0)), (Source { node: [NodeId(0), NodeId(3)], index: 1 }, (NodeId(2443952850), 2)), (Source { node: [NodeId(648511539128895861)], index: 0 }, (NodeId(271972563), 2)), (Source { node: [NodeId(648511539128895861), NodeId(1)], index: 0 }, (NodeId(3802644005), 1)), (Source { node: [NodeId(648511539128895861), NodeId(2)], index: 1 }, (NodeId(271972563), 2)), (Source { node: [NodeId(648511539128895861), NodeId(2)], index: 0 }, (NodeId(271972563), 1)), (Source { node: [NodeId(17505474457066797865)], index: 2 }, (NodeId(2719152001), 5)), (Source { node: [NodeId(17505474457066797865)], index: 1 }, (NodeId(2719152001), 1)), (Source { node: [NodeId(17505474457066797865), NodeId(0)], index: 0 }, (NodeId(2719152001), 5)), (Source { node: [NodeId(17505474457066797865), NodeId(536129167933390016)], index: 0 }, (NodeId(1627101688), 0)), (Source { node: [NodeId(17505474457066797865), NodeId(536129167933390016)], index: 1 }, (NodeId(1627101688), 1)), (Source { node: [NodeId(17505474457066797865), NodeId(6416337593867558447)], index: 0 }, (NodeId(165319789), 0)), (Source { node: [NodeId(17505474457066797865), NodeId(6416337593867558447)], index: 1 }, (NodeId(165319789), 1)), (Source { node: [NodeId(17505474457066797865), NodeId(6825362522106989504)], index: 0 }, (NodeId(4255178570), 0)), (Source { node: [NodeId(17505474457066797865), NodeId(6825362522106989504)], index: 1 }, (NodeId(4255178570), 1)), (Source { node: [NodeId(17505474457066797865), NodeId(7832534103926174319)], index: 1 }, (NodeId(2542087029), 1)), (Source { node: [NodeId(17505474457066797865), NodeId(7832534103926174319)], index: 0 }, (NodeId(2542087029), 0)), (Source { node: [NodeId(17505474457066797865), NodeId(8298558591740644999)], index: 1 }, (NodeId(1175147230), 1)), (Source { node: [NodeId(17505474457066797865), NodeId(8298558591740644999)], index: 0 }, (NodeId(1175147230), 0)), (Source { node: [NodeId(17505474457066797865), NodeId(12089252423572272489)], index: 1 }, (NodeId(2801556587), 1)), (Source { node: [NodeId(17505474457066797865), NodeId(12089252423572272489)], index: 0 }, (NodeId(2801556587), 0))]  ```    In the first borrow tree, all the sources are added properly. For example, the artboard node has sources for all inputs  ```  (Source { node: [NodeId(17505474457066797865)], index: 1 }, (NodeId(2719152001), 1)), (Source { node: [NodeId(17505474457066797865)], index: 2 }, (NodeId(2719152001), 5)), (Source { node: [NodeId(17505474457066797865)], index: 0 }  ```    However, in the second borrow tree, only the source for the first input is added.  ```  Source { node: [NodeId(648511539128895861)], index: 0 }, (NodeId(271972563), 2)),  ```    In fact, the second tree just has a total of 4 sources for the artboard node and its entire nested network, while the first tree has sources for every artboard node input and nested network input. Another observation is that the second inputs source map retains all the sources from the previous document (artboard id 17505474457066797865). It seems that the root issue is that the borrow tree is not being reset when changing networks. This means the nodes are being preserved, so nodes in the protonetwork for the new document are being skipped here:  ```  if !self.nodes.contains_key(&id) {      self.push_node(id, node, typing_context).await?;  }  ```    I think a solution could be to reset the borrow tree when switching documents, but I'm not sure what other effects this would have."
1755,New node: Rasterize,closed,https://github.com/GraphiteEditor/Graphite/pull/1755,TrueDoctor,,,1,2024-05-20T11:09:58Z,2024-06-27T08:24:11Z,2024-06-27T08:24:09Z,,Sí,Closes #1270
1754,Fix off by one subpath and unrelated crash,closed,https://github.com/GraphiteEditor/Graphite/pull/1754,0HyperCube,,,2,2024-05-18T20:35:47Z,2024-05-20T21:44:25Z,2024-05-20T21:44:24Z,,Sí,Fix my off by one subpath creation and also an unrelated crash from broken delete points code.
1753,Update the website layout with narrower default width and better typography,closed,https://github.com/GraphiteEditor/Graphite/pull/1753,Keavon,,,0,2024-05-18T07:41:46Z,2024-05-18T08:21:00Z,2024-05-18T08:20:59Z,,Sí,"- Reduces the default width from 1600px to 1200px of the web page and reduce the size of various elements and text. This fixes the problem that I designed the website assuming everyone is viewing from the same 2560px wide screen as I used to design it, which is a bad assumption. Most websites are around the 1200px mark.  - Removes the use of the EB Garamond font, replacing more headers with a bold Inter instead, leaving only Bona Nova for h1 headers at the tops of pages (except the home page, which might have further revamp soon).  - Adds nice flavor graphics to a redesigned volunteer page.  - Cleans up and organizes the Zola templating code and CSS style sheets.  - Improves image carousel to fade out images when dragged past the start or end."
1752,Update Git Attributes for JSON syntax highlighting in `*.graphite` files,closed,https://github.com/GraphiteEditor/Graphite/pull/1752,spenserblack,,,3,2024-05-13T13:54:23Z,2024-05-13T22:35:33Z,2024-05-13T22:35:33Z,,Sí,"This is just the type of small PR that I always compulsively do when I encounter a project with a new filetype :laughing:    This will apply the JSON syntax highlighting to *some* `*.graphite` files on GitHub (syntax highlighting is disabled for large minified files). It marks *most* `*.graphite` files as binary and generated, hiding diffs locally and in GitHub PRs. It reverts this for the graphite test files, since they seem to be manually written.    Currently, whether or not syntax highlighting is applied to `test_files/*.graphite` seems to almost be random (linguist's Bayesian classifer timing out perhaps :shrug:), but you can see in my fork that syntax highlighting is always applied."
1751,Fix primitive tool shapes appearing at document origin before dragging; fix Ctrl+0 recenter shifting,closed,https://github.com/GraphiteEditor/Graphite/pull/1751,elbertronnie,,,0,2024-05-10T17:56:25Z,2024-05-26T17:34:37Z,2024-05-22T09:31:27Z,,Sí,"<!-- Please reference any relevant issue number below, optionally with a ""Closes""/""Resolves""/""Fixes"" prefix -->    - Fixes the position of zero-sized shape upon mousedown before starting to draw the shape as specified in https://discord.com/channels/731730685944922173/881073965047636018/1111926515853164617.  - Fixes the indeterministic recenter by `Ctrl+0` as specified in https://discord.com/channels/731730685944922173/881073965047636018/1178103299547877426.  - Fix typo in `infinate`"
1750,Node network subgraph editing,closed,https://github.com/GraphiteEditor/Graphite/pull/1750,adamgerhant,,,0,2024-05-10T07:34:41Z,2024-06-02T08:01:58Z,2024-06-02T08:01:57Z,,Sí,"Closes #1172, closes #1765, and closes #1764. Discussion in [this Discord thread](https://discord.com/channels/731730685944922173/1238015208534966313).    Double-clicking nodes (except those based on proto nodes) enters their subgraph, replacing what's currently viewed in the node graph.    Todo  - [x] A breadcrumb trail shows which node you're in relative to the document's root network  - [x] Determine input/output type from compiled node network in order to display nodes without document definition.   - [x] Remove ""Imports"" field for node network, and instead store import index in each `NodeInput::Network`. This allows multiple nodes to use the same import field, and enables creation of the ""Imports"" node  - [x] Create a UI only ""Imports"" node, used for customizing the network import index for any node  - [x] Create a UI only ""Exports"" node, used for customizing the exports of a node  - [x] Save root node for each network, which is an `Option<NodeId>` default node that `DocumentMetadata` will use to display/update/add layers  - [x] Seperate NodeGraphMessages and GraphOperationMessages to ensure that tool and panel operations only affect document network, while graph UI operations only affect the selected network.  - [x] Add restrictions for selecting across different levels of nested networks      Issues:  - [x] Previews disappear when entering a nested network   - [x] Properties panel doesn't show information for selected layers in the document network when entering a nested network.  - [x] Ensure selected nodes are always in the same network  - [x] Auto node connection when dragging it onto a link creates an infinite loop that freezes the program  - [x] Auto node connection does not work between import and some node  - [x] Can't select import/export nodes  - [x] Root to export connection is doubled  - [x] Hide ""Preview"" for node not in current network, but show ""Make Hidden""  - [x] Properties panel does not work when not in the document network  - [x] Fix deleting node outside of nested network  - [x] Remove placeholder and replace with type name from definition if it exists (Boolean operation), if not then use name of data type.  - [x] Set root node to None if the primary export should be used as root  - [x] Can't move artboard in layer panel  - [x] Drawing artboard when there is a layer adds the layer to primary input, not secondary  - [x] New artboards are not added in layer stack, they are offset to left  - [x] Deleting layer does not delete children  - [x] Export input type not correct when previewing ToArtboard protonode  - [x] Swapping inputs for isolated nodes breaks them  - [x] Copy/cut and paste is broken in document network  - [x] Fix ""Preview""/""Stop Preview"" buttons  - [x] Errors don't display on node graph  - [x] Auto reconnect does not work when when deleted node is between import node and network node  - [x] Deleting node between import and export causes crash since it tries to reconnect, which is currently not supported.  - [x] Deleting layer inside of nested network randomly deletes children  - [x] Copy pasting node exposes all inputs  - [x] Add colors for internal types such as ""GraphicElement""  - [x] Swap node inputs for ConstructLayer and AddArtboardNode  - [x] Fix thumbnails not generating when entering and exiting a network  - [x] Copy and pasting nodes with network input retains their input.   - [x] Disconnecting between combine and split channels node doesn't work #1765  - [x] Copy and pasting protonodes does not resolve default tagged value from compiled network. They are instead set to None. Will require a rework for copying nodes (`map_ids`)  - [x] Inserting a non manual composition node, such as the ""Multiply"" node between the imports and some node crashes (can't reproduce)  - [x] Deleting split channels that is connected to combine channels crashes  - [x] Fix demo artwork    Deferred:  - [ ] Add positions for all `DocumentNodeDefinition` internal networks  - [ ] Reset transform in Graph.svelte when entering nested network - will fix in next PR when moving node graph state to Rust  - [ ] Resolved types for the Import node (which is derived from the parent node) is not saved for hidden node inputs. Nodes with manual composition also may have strange behavior #1767     Change to consider:  - If network cannot be rendered, remove all types from node graph, since they are from the last render and do not represent the current state  "
1749,Add Area and Centroid nodes,closed,https://github.com/GraphiteEditor/Graphite/pull/1749,elbertronnie,,,5,2024-05-09T20:08:29Z,2024-05-22T20:11:11Z,2024-05-22T20:11:11Z,,Sí,"<!-- Please reference any relevant issue number below, optionally with a ""Closes""/""Resolves""/""Fixes"" prefix -->    - Create Area and Centroid nodes which can provide the area and centroid of VectorData respectively.  - Create new function `perimeter_centroid` for `Bezier` and `Subpath` that calculates the line integral of position.  - Create new function `is_linear` which check if the bezier curve is equivalent to a line. Used in the calculation of intersection of two bezier curves where initially a line-like cubic bezier would give the wrong area."
1748,Fix artboards not being included in Export menu's bounds list,closed,https://github.com/GraphiteEditor/Graphite/pull/1748,adamgerhant,,,0,2024-05-09T05:01:46Z,2024-05-09T05:12:20Z,2024-05-09T05:08:03Z,,Sí,Adds artboards to export bound options when exporting image    Closes #1510
1747,Add artboard to export bounds,closed,https://github.com/GraphiteEditor/Graphite/pull/1747,adamgerhant,,,0,2024-05-09T04:56:52Z,2024-05-09T04:59:11Z,2024-05-09T04:57:47Z,,Sí,Adds artboards to export bound options when exporting image
1746,Fix image loading and remove resolve_empty_stacks() function,closed,https://github.com/GraphiteEditor/Graphite/pull/1746,TrueDoctor,,,0,2024-05-08T07:46:15Z,2024-05-08T08:31:42Z,2024-05-08T08:31:41Z,,Sí,"<!-- Please reference any relevant issue number below, optionally with a ""Closes""/""Resolves""/""Fixes"" prefix -->  Followup to #1740 "
1745,(Design suggestion) Replace GTK by a Rust GUI toolkit,closed,https://github.com/GraphiteEditor/Graphite/issues/1745,hardBSDk,,,5,2024-05-08T01:46:13Z,2025-01-08T12:03:21Z,2024-05-08T02:02:15Z,,No,I recommend egui or Iced.
1744,(Question) What is the Cargo package of the desktop client?,closed,https://github.com/GraphiteEditor/Graphite/issues/1744,hardBSDk,,,3,2024-05-08T01:36:57Z,2025-01-08T12:04:02Z,2024-05-08T01:47:08Z,,No,"I'm confused between `frontend/wasm`, `frontend/src-tauri` and `editor`, please document it."
1743,Add grid color customization and choice to display as dots,closed,https://github.com/GraphiteEditor/Graphite/pull/1743,adamgerhant,,,1,2024-05-08T01:25:46Z,2024-05-08T21:36:17Z,2024-05-08T21:36:16Z,,Sí,"Closes #1704, closes #1703    Adds a dot type grid option to create a pixel aligned dot grid. Snapping and spacing is the same as the rectangular grid.    Changes:  - Adds grid_overlay_dot  - Adds overlay_context.pixel  - UI changes for selecting the Dot option  - Color selector UI    Note: blocked by https://github.com/GraphiteEditor/Graphite/issues/1710 since initial color is not correct.  Initial color starts at `#999999` instead of `#cccccc`. An easy fix could be to replace the hex constant with a Color.    ![chrome_4ItMjh63Mi](https://github.com/GraphiteEditor/Graphite/assets/116332429/d0666a08-7fd0-4224-8818-25b0a7cee0ec)    "
1741,Contravariance for node inputs with automatic coercion,closed,https://github.com/GraphiteEditor/Graphite/issues/1741,TrueDoctor,,TrueDoctor,0,2024-05-07T20:43:21Z,2024-06-02T08:07:45Z,2024-05-07T23:36:26Z,Milestone 37,No,"**RFC: Contravariance for node inputs with automatic coercion:**  *Current Status:*  Currently the types supplied to functions are treated as invariant.  If node A is chained with node B and B expects an input of `T → V`, the type of node A has to be exactly `T → V`.   *Suggested Changes:*  Node inputs should be allowed to be **contravariant**. That means if the signature of A can be `T' → V` as long as T' ∝  T (With ∝ denoting the subtyping relation) = as long as T is more general than T'.  We then need to define a subtyping relation to have `()` to be the root of that relation.  In practice that means that any node which expects `T → V` can also take a node with `() -> V` as input.  *Implementation:*  For the implementation we have to consider two things: the type checking and the type coercion.  It should be pretty easy to extend the type checking to support contravariant function arguments.  Type coercion is a bit tricker, when using rustc for compilation we could just express this relationship using traits but due to the dynamic execution that is infeasible as it would lead to a type explosion for the node implementations.  Instead we'll have to insert explicit nodes to perform the conversion which work much like the cull node does currently.  *Performance Impact:*  When compiling with rustc this does not cause any runtime overhead. When linking the graph dynamically, it add the cost of calling an extra node. The compilation overhead is expected to be minimal.  *Open questions:*  How do we communicate this to the user / developer? When a chain A - B - C of nodes is created and A, C are resolution aware and B is not resolution aware, the typesystem would complain that the link between A and B is invalid even though node B itself is the problem, somewhat obfuscating the error.  *Alternatives:*  * Manually placing conversion nodes as necessary and adding more tooling to fix special cases like the bottom of a layer stack.  * Forcing everything to be resolution aware (this complicates caching, has a negative impact on performance and would be confusing to reason about)"
1740,Loosen the Graphene type system to allow contravariant function arguments,closed,https://github.com/GraphiteEditor/Graphite/pull/1740,TrueDoctor,,,2,2024-05-07T17:22:25Z,2024-05-07T23:36:26Z,2024-05-07T23:36:25Z,,Sí,This partially implements the contravariant function arguments RFC by permitting to call nodes with any input if the node expects to receive `()` as an input    Closes #1741 
1739,Fix duplicate selection when holding Alt and dragging with Select tool,closed,https://github.com/GraphiteEditor/Graphite/pull/1739,adamgerhant,,,0,2024-05-05T08:24:34Z,2024-05-07T01:34:33Z,2024-05-07T01:33:58Z,,Sí,Additional fixes to adjustment layers in PR #1712   Closes #1510
1738,Code cleanup and refactor for generalized layers,closed,https://github.com/GraphiteEditor/Graphite/pull/1738,adamgerhant,,,0,2024-05-03T05:21:22Z,2024-05-05T05:11:49Z,2024-05-05T05:11:48Z,,Sí,"Closes #1510, a follow-up to PR #1712.    Fixes undo bugs by extracting functions into messages. Generalized Copy and Paste for any layer node, and mapped duplicate layers (ctrl+D) to copy and paste.    Refactored Messages:  `DocumentMessage::DuplicateSelectedLayers`  `DocumentMessage::GroupSelectedLayers`  `DocumentMessage::MoveSelectedLayersTo`  `DocumentMessage::UngroupSelectedLayers`  `NodeGraphMessage::DisconnectNodes`  `NodeGraphMessage::InsertNodeBetween`  `GraphOperationMessage::MoveSelectedSiblingsToChild`  `PortfolioMessage::Copy`  `PortfolioMessage::PasteSerializedData`    New Messages:  `NodeGraphMessage::DisconnectLayerFromStack`  `NodeGraphMessage::SetNodePosition`  `NodeGraphMessage::ShiftUpstream`  `GraphOperationMessage::AddNodesAsChild`  `GraphOperationMessage::DisconnectInput`  `GraphOperationMessage::InsertLayerAtStackIndex`  `GraphOperationMessage::InsertNodeBetween`  `GraphOperationMessage::MoveSelectedSiblingsToChild`          "
1737,[Crash Report] ,closed,https://github.com/GraphiteEditor/Graphite/issues/1737,Twst-Wold,,,1,2024-04-27T15:37:27Z,2024-04-28T09:38:54Z,2024-04-28T09:38:53Z,,No,"**Describe the Crash**  Explain clearly what you were doing when the crash occurred.    **Steps To Reproduce**  Describe precisely how the crash occurred, step by step, starting with a new editor window.  1. Open the Graphite Editor at https://editor.graphite.rs  2. upload a image  3. close the site  4. reopen the file  5. image will not save and break it    **Additional Details**  Provide any further information or context that you think would be helpful in fixing the issue. Screenshots or video can be linked or attached to this issue.    **Browser and OS**  Firefox 125, Windows 10 or 11    **Stack Trace**  Copied from the crash dialog in the Graphite Editor:    ```  panicked at 'Blob url for invalid layer: LayerNotFound([])', graphene/src/document.rs:757:29    384/wt/<@https://draw.fusestudio.net/js/app.f073b76c.js:9:995  n@https://draw.fusestudio.net/js/app.f073b76c.js:1:8158  384/Ze/t<@https://draw.fusestudio.net/js/app.f073b76c.js:1:8656  738/</Cn/<@https://draw.fusestudio.net/js/123.8cf8518c.js:1:13830  N@https://draw.fusestudio.net/js/123.8cf8518c.js:1:5550  Cn@https://draw.fusestudio.net/js/123.8cf8518c.js:1:13796  @https://draw.fusestudio.net/00564ac8b129e36f.module.wasm:wasm-function[2339]:0x1c2ee5  @https://draw.fusestudio.net/00564ac8b129e36f.module.wasm:wasm-function[872]:0x1696bc  @https://draw.fusestudio.net/00564ac8b129e36f.module.wasm:wasm-function[680]:0x14f75a  @https://draw.fusestudio.net/00564ac8b129e36f.module.wasm:wasm-function[1861]:0x1b4cf0  @https://draw.fusestudio.net/00564ac8b129e36f.module.wasm:wasm-function[1769]:0x1b08c8  @https://draw.fusestudio.net/00564ac8b129e36f.module.wasm:wasm-function[1920]:0x1b729c  @https://draw.fusestudio.net/00564ac8b129e36f.module.wasm:wasm-function[2612]:0x1c76fc  @https://draw.fusestudio.net/00564ac8b129e36f.module.wasm:wasm-function[2326]:0x1c2a6b  @https://draw.fusestudio.net/00564ac8b129e36f.module.wasm:wasm-function[2528]:0x1c6579  @https://draw.fusestudio.net/00564ac8b129e36f.module.wasm:wasm-function[1990]:0x1b9b6d  @https://draw.fusestudio.net/00564ac8b129e36f.module.wasm:wasm-function[53]:0xdf20  @https://draw.fusestudio.net/00564ac8b129e36f.module.wasm:wasm-function[56]:0x1f19a  @https://draw.fusestudio.net/00564ac8b129e36f.module.wasm:wasm-function[57]:0x232e3  @https://draw.fusestudio.net/00564ac8b129e36f.module.wasm:wasm-function[125]:0x8fea5  @https://draw.fusestudio.net/00564ac8b129e36f.module.wasm:wasm-function[906]:0x16d739  @https://draw.fusestudio.net/00564ac8b129e36f.module.wasm:wasm-function[918]:0x16ec51  @https://draw.fusestudio.net/00564ac8b129e36f.module.wasm:wasm-function[1999]:0x1ba004  setImageBlobUrl@https://draw.fusestudio.net/js/123.8cf8518c.js:1:11040  384/a/get/<@https://draw.fusestudio.net/js/app.f073b76c.js:1:532  384/qe/</<@https://draw.fusestudio.net/js/app.f073b76c.js:1:9069  ```"
