number,title,state,html_url,user,labels,assignee,comments,created_at,updated_at,closed_at,milestone,is_pull_request,body
2827,"Improve hotkeys with canonical flag, more industry-standard mappings, and fix GRS menu bar labels",closed,https://github.com/GraphiteEditor/Graphite/pull/2827,Keavon,,,0,2025-07-04T11:50:24Z,2025-07-04T11:58:53Z,2025-07-04T11:58:52Z,,Sí,"The `input_mappings.rs` entries now accept the `canonical` argument which should occur no more than once per action and it means that it should be the standard shortcut which hotkey labels and tooltips in the UI are generated for.    ---    Hotkeys were updated a bit to use slightly more common shortcuts, as well as aliases added for cases where people may be more familiar with an alternative key. In particular, we now reset the working colors with <kbd>D</kbd> which had not been used as a shortcut otherwise.    ---    These were missing which is now a fixed problem:    ![capture](https://github.com/user-attachments/assets/00f0444e-76c7-422e-bafd-83abcb97b911)"
2825,Fix broken migration for `CoordinateValueNode`,closed,https://github.com/GraphiteEditor/Graphite/pull/2825,Firestar99,,,0,2025-07-03T12:05:56Z,2025-07-03T12:12:20Z,2025-07-03T12:12:19Z,,Sí,
2820,Yo,closed,https://github.com/GraphiteEditor/Graphite/issues/2820,omid717,,,0,2025-07-02T11:25:08Z,2025-07-02T11:26:57Z,2025-07-02T11:26:57Z,,No,- [ ] > []()uea``
2813,"Clean up node catalog by adding missing units, more tooltips; fix 'Line' node missing parameters",closed,https://github.com/GraphiteEditor/Graphite/pull/2813,Keavon,,,0,2025-07-01T12:30:29Z,2025-07-01T14:47:56Z,2025-07-01T14:47:55Z,,Sí,"- Audit and resolve units on all node macro node signatures  - Add new descriptions for math node parameter tooltips  - Fix ""Line"" node missing parameters when constructed from the new nodes menu  - Tidy up node code"
2811,Jj,closed,https://github.com/GraphiteEditor/Graphite/issues/2811,Lavluuuuuu,,,0,2025-07-01T09:09:56Z,2025-07-01T09:18:53Z,2025-07-01T09:18:36Z,,No,
2809,[Crash Report] Opening new document crashes in firefox,closed,https://github.com/GraphiteEditor/Graphite/issues/2809,nrjais,,,5,2025-07-01T05:06:15Z,2025-07-01T15:38:53Z,2025-07-01T15:13:13Z,,No,"**Describe the Crash** Explain clearly what you were doing when the crash occurred.  **Steps To Reproduce** Describe precisely how the crash occurred, step by step, starting with a new editor window. 1. Open the Graphite editor at https://editor.graphite.rs 2. Create new document 3.  4.  5.   **Additional Details** Provide any further information or context that you think would be helpful in fixing the issue. Screenshots or video can be linked or attached to this issue.  **Browser and OS** Firefox 142, Mac  **Stack Trace** Copied from the crash dialog in the Graphite editor:  ``` panicked at editor/src/node_graph_executor.rs:100:78: Failed to send generation request: ""sending on a closed channel""  Fp/<@https://editor.graphite.rs/assets/index-DCQHZjFB.js:943:1179 g@https://editor.graphite.rs/assets/index-DCQHZjFB.js:929:64931 handleJsMessage@https://editor.graphite.rs/assets/index-DCQHZjFB.js:929:65079 vp/e<@https://editor.graphite.rs/assets/index-DCQHZjFB.js:929:65472 j2/o.wbg.__wbg_call_833bed5770ea2041/<@https://editor.graphite.rs/assets/index-DCQHZjFB.js:929:12695 vt@https://editor.graphite.rs/assets/index-DCQHZjFB.js:928:6130 j2/o.wbg.__wbg_call_833bed5770ea2041@https://editor.graphite.rs/assets/index-DCQHZjFB.js:929:12665 graphite_wasm.wasm._ZN13graphite_wasm10editor_api12EditorHandle27send_frontend_message_to_js17h0668831c386ddb67E@https://editor.graphite.rs/assets/graphite_wasm_bg-9GuQ_qVQ.wasm:wasm-function[3750]:0x8b52d3 graphite_wasm.wasm._ZN4core3ops8function2Fn4call17h7e50954c4596dc1dE@https://editor.graphite.rs/assets/graphite_wasm_bg-9GuQ_qVQ.wasm:wasm-function[14332]:0xba9680 graphite_wasm.wasm._ZN3std9panicking20rust_panic_with_hook17h1f8226e239ffaa71E@https://editor.graphite.rs/assets/graphite_wasm_bg-9GuQ_qVQ.wasm:wasm-function[7604]:0xa908ae graphite_wasm.wasm._ZN4core9panicking9panic_fmt17hb6c28595a1feee80E@https://editor.graphite.rs/assets/graphite_wasm_bg-9GuQ_qVQ.wasm:wasm-function[11844]:0xb7e006 graphite_wasm.wasm._ZN4core6result13unwrap_failed17h0af004c27326640fE@https://editor.graphite.rs/assets/graphite_wasm_bg-9GuQ_qVQ.wasm:wasm-function[9341]:0xb3ae0f graphite_wasm.wasm._ZN15graphite_editor19node_graph_executor17NodeGraphExecutor28submit_node_graph_evaluation17haf89eb45f7a7a755E@https://editor.graphite.rs/assets/graphite_wasm_bg-9GuQ_qVQ.wasm:wasm-function[2025]:0x6eec94 graphite_wasm.wasm._ZN325_$LT$graphite_editor..messages..portfolio..portfolio_message_handler..PortfolioMessageHandler$u20$as$u20$graphite_editor..utility_traits..MessageHandler$LT$graphite_editor..messages..portfolio..portfolio_message..PortfolioMessage$C$graphite_editor..messages..portfolio..portfolio_message_handler..PortfolioMessageData$GT$$GT$15process_message17h88e94f21d76b7b9bE@https://editor.graphite.rs/assets/graphite_wasm_bg-9GuQ_qVQ.wasm:wasm-function[309]:0x95613 graphite_wasm.wasm._ZN15graphite_editor10dispatcher10Dispatcher14handle_message17hef80e4234270813cE@https://editor.graphite.rs/assets/graphite_wasm_bg-9GuQ_qVQ.wasm:wasm-function[435]:0x2538e6 graphite_wasm.wasm._ZN13graphite_wasm10editor_api12EditorHandle19widget_value_update17hb8f1338393aa2634E@https://editor.graphite.rs/assets/graphite_wasm_bg-9GuQ_qVQ.wasm:wasm-function[2059]:0x7052d8 graphite_wasm.wasm.editorhandle_widgetValueCommitAndUpdate externref shim multivalue shim@https://editor.graphite.rs/assets/graphite_wasm_bg-9GuQ_qVQ.wasm:wasm-function[11847]:0xb7e318 widgetValueCommitAndUpdate@https://editor.graphite.rs/assets/index-DCQHZjFB.js:929:4156 h@https://editor.graphite.rs/assets/index-DCQHZjFB.js:970:57629 Ce@https://editor.graphite.rs/assets/index-DCQHZjFB.js:970:58212 n@https://editor.graphite.rs/assets/index-DCQHZjFB.js:970:50249 h@https://editor.graphite.rs/assets/index-DCQHZjFB.js:967:65697 ```"
2806,Wrong link in frontend/README.md,closed,https://github.com/GraphiteEditor/Graphite/issues/2806,alvarogalloc,,,1,2025-06-30T18:46:58Z,2025-07-02T03:06:57Z,2025-07-02T03:06:57Z,,No,https://github.com/GraphiteEditor/Graphite/blob/master/frontend/README.md has a hyperlink 'Tauri' that refers to https://tauri.studio/ instead of https://tauri.app/ in line 5
2805,Fix running tests locally; fix migrations for relocated nodes,closed,https://github.com/GraphiteEditor/Graphite/pull/2805,Firestar99,,,0,2025-06-30T17:44:49Z,2025-07-04T09:56:23Z,2025-07-04T09:56:22Z,,Sí,
2802,Disable preprocessor insertion of IntoNodes in the graph to avoid intermittent math node type errors,closed,https://github.com/GraphiteEditor/Graphite/pull/2802,TrueDoctor,,,0,2025-06-30T09:09:08Z,2025-07-03T12:41:46Z,2025-06-30T10:07:09Z,,Sí,Temporarily fixes regression introduced in #2478
2801,Fix: Unsafe File Access Could Allow Unauthorized Data Retrieval in website/install-fonts.js,closed,https://github.com/GraphiteEditor/Graphite/pull/2801,kira-offgrid,,,1,2025-06-30T04:34:02Z,2025-06-30T04:44:51Z,2025-06-30T04:40:28Z,,Sí,"**Context and Purpose:**  This PR automatically remediates a security vulnerability: - **Description:** Detected possible user input going into a `path.join` or `path.resolve` function. This could possibly lead to a path traversal vulnerability,  where the attacker can access arbitrary files stored in the file system. Instead, be sure to sanitize or validate user input first. - **Rule ID:** javascript.lang.security.audit.path-traversal.path-join-resolve-traversal.path-join-resolve-traversal - **Severity:** MEDIUM - **File:** website/install-fonts.js - **Lines Affected:** 84 - 84  This change is necessary to protect the application from potential security risks associated with this vulnerability.  **Solution Implemented:**  The automated remediation process has applied the necessary changes to the affected code in `website/install-fonts.js` to resolve the identified issue.  Please review the changes to ensure they are correct and integrate as expected."
2800,Fix: GitHub Actions Script Vulnerable to Code Injection Attacks in .github/workflows/comment-!build-commands.yml,closed,https://github.com/GraphiteEditor/Graphite/pull/2800,kira-offgrid,,,1,2025-06-30T04:33:08Z,2025-06-30T04:44:41Z,2025-06-30T04:41:54Z,,Sí,"**Context and Purpose:**  This PR automatically remediates a security vulnerability: - **Description:** Using variable interpolation `${{...}}` with `github` context data in a `run:` step could allow an attacker to inject their own code into the runner. This would allow them to steal secrets and code. `github` context data can have arbitrary user input and should be treated as untrusted. Instead, use an intermediate environment variable with `env:` to store the data and use the environment variable in the `run:` script. Be sure to use double-quotes the environment variable, like this: ""$ENVVAR"". - **Rule ID:** yaml.github-actions.security.run-shell-injection.run-shell-injection - **Severity:** HIGH - **File:** .github/workflows/comment-!build-commands.yml - **Lines Affected:** 83 - 93  This change is necessary to protect the application from potential security risks associated with this vulnerability.  **Solution Implemented:**  The automated remediation process has applied the necessary changes to the affected code in `.github/workflows/comment-!build-commands.yml` to resolve the identified issue.  Please review the changes to ensure they are correct and integrate as expected."
2797,Fix links in docs,closed,https://github.com/GraphiteEditor/Graphite/pull/2797,Moharum1,,,1,2025-06-29T20:59:38Z,2025-06-29T23:15:20Z,2025-06-29T23:15:19Z,,Sí,Closes ##2479    
2792,Fix lasso select extending the previous selection area after it was aborted,closed,https://github.com/GraphiteEditor/Graphite/pull/2792,hemu,,,2,2025-06-29T03:24:30Z,2025-06-29T05:19:51Z,2025-06-29T05:19:51Z,,Sí,"Currently after aborting an in-progress lasso selection with RMB or ESC, starting a new lasso selection will extend the previous lasso selection instead of starting a new selection. This fix ensures the previous selection is cleared after abort.    Part of #2647    # before fix  https://github.com/user-attachments/assets/647fecd5-1be1-4b88-a902-6b3e739979d3    # after fix  https://github.com/user-attachments/assets/cd9a44c2-7259-4972-b1cf-0d064e4e1f04"
2791,Sliders get stuck to the mouse,closed,https://github.com/GraphiteEditor/Graphite/issues/2791,celyk,,,0,2025-06-29T03:11:25Z,2025-06-29T03:11:56Z,2025-06-29T03:11:56Z,,No,Some sliders don't stop scrolling after mouse up. Very annoying. The ranged sliders like rotation however don't have this issue  https://github.com/user-attachments/assets/cf94c2d7-9f14-43a0-9521-4bdadf69e457  Specs: MacBook Air M2 Safari 18.3 
2787,Fix the 'Split Coordinate' node that was broken in an earlier refactor commit,closed,https://github.com/GraphiteEditor/Graphite/pull/2787,Firestar99,,,0,2025-06-28T14:39:28Z,2025-06-30T06:49:01Z,2025-06-30T06:49:00Z,,Sí,"forgot a rename, there will probably be even more nodes I missed"
2784,Extract `gbrush`,closed,https://github.com/GraphiteEditor/Graphite/pull/2784,Firestar99,,,0,2025-06-28T11:01:24Z,2025-07-01T18:38:48Z,2025-07-01T18:38:48Z,,Sí,# Requires https://github.com/GraphiteEditor/Graphite/pull/2783
2783,Extract `graster-nodes`,closed,https://github.com/GraphiteEditor/Graphite/pull/2783,Firestar99,,,0,2025-06-28T11:00:52Z,2025-07-01T18:12:13Z,2025-07-01T18:12:12Z,,Sí,# Requires https://github.com/GraphiteEditor/Graphite/pull/2782
2782,node macro: copy visibility from node function,closed,https://github.com/GraphiteEditor/Graphite/pull/2782,Firestar99,,,0,2025-06-28T10:26:43Z,2025-07-01T15:29:01Z,2025-07-01T15:29:00Z,,Sí,No longer requires anything
2781,Update demo artwork to newest version,closed,https://github.com/GraphiteEditor/Graphite/pull/2781,TrueDoctor,,,3,2025-06-28T07:37:06Z,2025-07-02T06:36:06Z,2025-07-02T06:36:06Z,,Sí,"<!-- Please reference any relevant issue number below, optionally with a ""Closes""/""Resolves""/""Fixes"" prefix -->    This should be merged before the profiling pr #2780  since we currently can't profile the changes due to outdated document versions  "
2773,Fix Shape tool custom color picker using gamma not linear space,closed,https://github.com/GraphiteEditor/Graphite/pull/2773,0HyperCube,,,0,2025-06-27T23:56:05Z,2025-06-28T01:32:15Z,2025-06-28T01:32:14Z,,Sí,"<!-- Please reference any relevant issue number below, optionally with a ""Closes""/""Resolves""/""Fixes"" prefix -->    Closes #2769.    Colours should all be in linear space.  "
2772,Fix incorrectly calculating nonzero-area bounding boxes for empty raster images,closed,https://github.com/GraphiteEditor/Graphite/pull/2772,0HyperCube,,,0,2025-06-27T23:47:40Z,2025-06-28T02:37:39Z,2025-06-28T02:37:37Z,,Sí,When there is a raster layer with zero width/height it shouldn't get a bounding box.
2771,Only compute bounding box for layers being rendered by Vello when actually used,closed,https://github.com/GraphiteEditor/Graphite/pull/2771,TrueDoctor,,,0,2025-06-27T21:56:04Z,2025-06-28T02:06:53Z,2025-06-28T02:06:52Z,,Sí,"<!-- Please reference any relevant issue number below, optionally with a ""Closes""/""Resolves""/""Fixes"" prefix -->      "
2770,Fix DropdownInput widget not reactively updating when its content changes,closed,https://github.com/GraphiteEditor/Graphite/pull/2770,0HyperCube,,,1,2025-06-27T20:35:23Z,2025-06-28T02:59:04Z,2025-06-28T02:59:03Z,,Sí,I though the idea of svelte was that it did the fine grained reactivity automatically?    I guess maybe they fixed this in the new version?
2769,"Color in Tool Color Picker is Scaled for Shape Tools (Line, Rectangle, Ellipse, Shape)",closed,https://github.com/GraphiteEditor/Graphite/issues/2769,harrhunt,,0HyperCube,0,2025-06-27T17:43:55Z,2025-07-02T02:44:56Z,2025-06-28T01:32:15Z,Milestone 49,No,"This affects the line, rectangle, ellipse, and shape tools. Happens with both mouse drag and text input. Present on https://github.com/GraphiteEditor/Graphite/commit/9c4ab34a5830932a1aa4d485d2f511a2061896ef  https://github.com/user-attachments/assets/d5c8ddb8-b24a-477e-ba3b-bb84ef18943b"
2766,Suggestions/Requests: Graphite is awesome!,closed,https://github.com/GraphiteEditor/Graphite/issues/2766,fmchris10,,,2,2025-06-27T13:31:33Z,2025-06-29T20:14:26Z,2025-06-29T09:32:17Z,,No,"Firstly, thank you to everyone involved with this. I read an article earlier that promoted this project, and I am very impressed. The UI looks so easy to use, and it's the nicest online editor.  Additional formats such as, .webp .avif, .gif etc would be useful. Compression levels are very useful for those who edit images while online.  You probably already have plans for these, but I thought I would request or suggest them. I do a lot of work for my websites while on the move; I am Android-based. I currently use Photopea, which is awesome, but it can be fiddly on a tablet, especially when using the touchscreen. The ads can be distracting, too, and whilst I am not remotely against them, it does make an impact when trying to edit a simple image quickly. Due to the cost involved, I am unable to pay for Photopea, but I have donated.  I will be looking to make Graphite my go to online editor for sure. "
2765,Fix Path tool multi-point handle scaling behavior and double-click smooth/sharp conversion on rectangles,closed,https://github.com/GraphiteEditor/Graphite/pull/2765,0SlowPoke0,,,1,2025-06-27T10:41:00Z,2025-06-30T07:56:23Z,2025-06-30T07:56:22Z,,Sí," - fixed while scaling 2+ anchors ,should scale to their common center while also scaling their handles in unison.   - double-click on anchor connected to linear segments fails to flip between smooth-sharp"
2764,"Extract `gmath_nodes` from `gcore::ops`, create mods `debug` and `extract_xy`",closed,https://github.com/GraphiteEditor/Graphite/pull/2764,Firestar99,,,0,2025-06-27T10:34:31Z,2025-06-27T22:04:26Z,2025-06-27T22:04:24Z,,Sí,# Requires https://github.com/GraphiteEditor/Graphite/pull/2760    Split out from https://github.com/GraphiteEditor/Graphite/pull/2746#issuecomment-3012398175
2763,Stacked pr ci,closed,https://github.com/GraphiteEditor/Graphite/pull/2763,Firestar99,,,0,2025-06-27T10:28:41Z,2025-06-27T12:40:56Z,2025-06-27T12:40:54Z,,Sí,"allow ci to run on PRs which don't target master, since I commonly change the base in my stacked PRs to not be master but the previous PR in the stack"
2762,Extract `gpath_bool` from `mod gstd::ops` path_bool-related nodes,closed,https://github.com/GraphiteEditor/Graphite/pull/2762,Firestar99,,,0,2025-06-27T10:18:41Z,2025-06-27T13:12:09Z,2025-06-27T13:12:08Z,,Sí,# Requires https://github.com/GraphiteEditor/Graphite/pull/2763    Split out from https://github.com/GraphiteEditor/Graphite/pull/2759#issuecomment-3012399288
2761,Fix regression in previous commit where node parameter updates didn't refresh the render,closed,https://github.com/GraphiteEditor/Graphite/pull/2761,0SlowPoke0,,,0,2025-06-27T08:31:38Z,2025-06-27T08:42:11Z,2025-06-27T08:42:10Z,,Sí,"Fixes an issue where changes made in the Properties panel didn’t update , until the user panned cause by regression in #2748 "
2760,"Extract `gsvg_renderer` from `gcore`, remove `gcore/vello` feature ",closed,https://github.com/GraphiteEditor/Graphite/pull/2760,Firestar99,,,0,2025-06-26T17:56:40Z,2025-06-27T13:47:47Z,2025-06-27T13:47:46Z,,Sí,# Requires https://github.com/GraphiteEditor/Graphite/pull/2762
2759,Prep `gcore` splitup 2: Vector extension traits,closed,https://github.com/GraphiteEditor/Graphite/pull/2759,Firestar99,,,1,2025-06-26T17:56:14Z,2025-06-27T10:30:15Z,2025-06-27T10:30:12Z,,Sí,# Requires https://github.com/GraphiteEditor/Graphite/pull/2746
2758,Fixes for Alpha .exe and windows installers builds - windows Alpha release,closed,https://github.com/GraphiteEditor/Graphite/pull/2758,davad00,,,3,2025-06-26T15:22:48Z,2025-06-27T01:02:34Z,2025-06-26T18:06:02Z,,Sí,"Updates the node graph to streamline vector geometry processing and UI components.    The changes include:  - Renaming `Sample Polyline` node to `Sample Points` node  - Removing `PointSpacingType` enum and properties from the UI    These changes improve code readability and streamline the node graph. The update enables a smoother transition from older file formats.    Also enables devtools in the Tauri app during development.    Refactors node graph and UI components    <!-- Please reference any relevant issue number below, optionally with a ""Closes""/""Resolves""/""Fixes"" prefix -->    Closes #  "
2756,"[BUG] Persistent ""New Document"" Popup",closed,https://github.com/GraphiteEditor/Graphite/issues/2756,PedroMAdorno4,,,21,2025-06-26T02:11:14Z,2025-06-26T11:08:27Z,2025-06-26T11:08:27Z,,No,"I created a sketch and imported an image I took with my phone. Immediately, performance dropped to perhaps sub-1 fps. Hovering over anything didn´t show anything, nor did trying via shortcuts. Some time later, I decided to start a sketch from scratch, and when selecting the ""New document"" 'OK' option, it opened my previous ""document"" with the image that lagged everything, and the ""new document"" popup persisted. I'm including a short video, but the issue seems to be a width event listener not being de-registered and causing the bug.  Basically, I'm stuck with ""New Document"" popup and it doesn't matter if I'm on a new document or not, nor does pressing ""ok"" or ""cancel"" change anything  Images show a thousand words, so here we go:  ![Image](https://github.com/user-attachments/assets/9f11b852-abe2-4f21-8fe3-59d4028ed3c7)"
2754,Fix 'Morph' node lerping the target paths to its end point instead of start point,closed,https://github.com/GraphiteEditor/Graphite/pull/2754,indierusty,,,0,2025-06-25T07:34:05Z,2025-06-26T07:44:23Z,2025-06-26T07:44:22Z,,Sí,"<!-- Please reference any relevant issue number below, optionally with a ""Closes""/""Resolves""/""Fixes"" prefix -->  Fixes a regression introduced in PR #2696   "
2752,Adjust handles on point dissolve,closed,https://github.com/GraphiteEditor/Graphite/pull/2752,HWienhold,,,0,2025-06-24T23:16:44Z,2025-06-25T17:22:57Z,2025-06-25T17:22:57Z,,Sí,resolves #2651   
2750,Boolean operations no longer work the same,closed,https://github.com/GraphiteEditor/Graphite/issues/2750,harrhunt,,Keavon,5,2025-06-24T16:16:44Z,2025-07-02T02:44:56Z,2025-06-25T01:23:29Z,Milestone 49,No,"I noticed that some boolean operations I had been using stopped working a few days ago. I went through the builds in the dev & CI actions and it looks like they work on [https://f20c6739.graphite.pages.dev/](https://f20c6739.graphite.pages.dev/) but not on [https://fc501545.graphite.pages.dev/](https://fc501545.graphite.pages.dev/) I was specifically using **subtract front**, but it looks like some of the other boolean operations also have issues.  https://github.com/user-attachments/assets/def62c27-3ae9-4929-9917-23f60f3debee"
2749,Boolean operation fills holes in some cases,closed,https://github.com/GraphiteEditor/Graphite/issues/2749,Projectius,,,2,2025-06-24T15:32:51Z,2025-06-26T05:41:58Z,2025-06-26T05:41:58Z,,No,![Image](https://github.com/user-attachments/assets/973c02e4-c33e-45d9-b61d-d76876e81c57)  https://github.com/user-attachments/assets/438164f8-8835-426f-99a1-216fc07c1f3b
2748,Refactor shape gizmo interactivity to support future shape tools,closed,https://github.com/GraphiteEditor/Graphite/pull/2748,0SlowPoke0,,,0,2025-06-24T08:02:47Z,2025-06-27T05:35:20Z,2025-06-27T05:34:36Z,,Sí," Followup PR of #2683, and this fixes the two bugs mentioned by @Keavon in that.      ## ShapeGizmoHandler trait    Provides a common interface for shape-specific interactive gizmos (e.g., Star, Polygon).    Defines methods for handling state updates, clicks, dragging, overlays, and cleanup.    ## ShapeGizmoHandlers enum    Enum wrapper that abstracts over concrete shape gizmo types.    ## GizmoManager struct    Central controller that detects active gizmo layers, handles hover/click/drag input, and manages rendering.    Groups selected layers by shape type and activates the correct gizmo when hovered."
2746,Prep `gcore` splitup: move various symbols into their own modules,closed,https://github.com/GraphiteEditor/Graphite/pull/2746,Firestar99,,,1,2025-06-23T12:03:16Z,2025-06-27T09:54:36Z,2025-06-27T09:54:34Z,,Sí,"Moving some symbols within `gcore` to their own modules, to allow them to remain within `gcore` and move the rest into separate crates in a later PR."
2745,"Make `wasm` only depend on `gstd`, not `gcore`",closed,https://github.com/GraphiteEditor/Graphite/pull/2745,Firestar99,,,0,2025-06-23T09:02:02Z,2025-06-23T10:30:42Z,2025-06-23T10:30:42Z,,Sí,# Requires https://github.com/GraphiteEditor/Graphite/pull/2742
2742,Extract `gapplication_io` from `gcore`,closed,https://github.com/GraphiteEditor/Graphite/pull/2742,Firestar99,,,0,2025-06-21T22:35:00Z,2025-06-23T09:35:16Z,2025-06-23T09:35:14Z,,Sí,# Requires https://github.com/GraphiteEditor/Graphite/pull/2737    Removes the `wasm` features from `gcore` and the `web_sys` dependency.
2741,Reduce development environment warnings and remove DWARF debug symbols,closed,https://github.com/GraphiteEditor/Graphite/pull/2741,0HyperCube,,,0,2025-06-20T21:51:35Z,2025-06-22T10:10:27Z,2025-06-22T10:10:25Z,,Sí,- Ignore tauri gen folder  - Deny warnings on CI (runs after cloudflare publish)  - Fix all warnings on current rust nightly  - Disable DWARF debugging to reduce compile times and RAM usage from wasm-bindgen.
2739,"Replace Rustybuzz with Parley for text layout, and add text tilt parameter",closed,https://github.com/GraphiteEditor/Graphite/pull/2739,BKSalman,,,12,2025-06-20T10:05:03Z,2025-07-01T20:51:53Z,2025-07-01T09:23:18Z,,Sí," related to #1105    this adds [Parley](https://github.com/linebender/parley) which handles a lot of text related stuff for us    I made this PR to get feedback on the changes    and after this is accepted, some of the listed TODOs from [this issue](https://github.com/GraphiteEditor/Graphite/issues/1105) can be resolved easily, which I could either add to this PR, or make another PR for them      I've created this [simple file](https://github.com/user-attachments/files/20854910/Arabic.test.graphite.txt) that I tested with, you can also use it (you need to use a font that supports Arabic, something like `Tajawal`)    it should look like this  ![image](https://github.com/user-attachments/assets/8ab2bbac-e6e6-4755-82cb-95af3f8be1d3)    TODOs:  - [x] Add parley  - [x] Remove rustybuzz  - [x] Migrate text node from old implementation      - [x] Change default character spacing to 0     - [x] detect the number of parameters that exist on the text node and do the migration only when it doesn't match the new number of parameters  - [x] Add shear"
2738,[Docker] Built image and successfully ran,closed,https://github.com/GraphiteEditor/Graphite/issues/2738,SHU-red,,,2,2025-06-19T09:34:18Z,2025-06-19T12:23:04Z,2025-06-19T11:59:12Z,,No,"Hi there, i got graphite production successfully running - build via dockerfile - run via docker-compose  Although my implementation may not be the cleanest at the moment i wanted to ask if anyone likes me to contribute my content here?"
2737,Remove the `serde` feature and instead just always require it,closed,https://github.com/GraphiteEditor/Graphite/pull/2737,Firestar99,,,0,2025-06-18T16:25:20Z,2025-06-21T23:52:49Z,2025-06-21T23:52:47Z,,Sí,# Requires https://github.com/GraphiteEditor/Graphite/pull/2736    Everything needs serde anyway
