number,title,state,html_url,user,labels,assignee,comments,created_at,updated_at,closed_at,milestone,is_pull_request,body
2065,"In the Path tool, make Space shift the anchor while dragging handles",closed,https://github.com/GraphiteEditor/Graphite/pull/2065,DaraghD,,,5,2024-10-21T20:00:09Z,2024-10-26T09:20:09Z,2024-10-26T09:20:09Z,,Sí,"Naming probs needs some changes  [Screencast_20241021_205201.webm](https://github.com/user-attachments/assets/5beaf148-a1d2-4612-8608-52998abeff9d)    ~~The points dont get highlighted until the cursor moves them, which isnt great although im not currently sure how to solve that, maybe moving them slightly back and forward or their might be some message I need to pass. This is also the case with my previous pr #2058~~  Partially closes #1870"
2064,Add switch node and fix log to console node,closed,https://github.com/GraphiteEditor/Graphite/pull/2064,TrueDoctor,,,1,2024-10-21T18:29:53Z,2024-10-25T23:30:03Z,2024-10-25T23:30:02Z,,Sí,"<!-- Please reference any relevant issue number below, optionally with a ""Closes""/""Resolves""/""Fixes"" prefix -->    "
2063,Crash when hiding the rectangle node,closed,https://github.com/GraphiteEditor/Graphite/issues/2063,0HyperCube,"Crash,Graphene",adamgerhant,0,2024-10-21T09:41:01Z,2024-12-23T23:21:06Z,2024-10-25T23:54:39Z,Milestone 42,No,"- Open https://dev.graphite.rs/  - Draw a rectangle  - Scroll down to the bottom of the properties  - Hover over the rectangle section  - Click the eye icon to hide the node  - Crash.    ```  panicked at node-graph/graph-craft/src/document.rs:321:9:  received value as input. inputs: [      Value {          tagged_value: MemoHash {              hash: 14709398186846620400,              value: None,          },          exposed: false,      },  ], construction_args: Nodes(      [],  )    graphite_wasm.wasm.graph_craft::document::DocumentNode::resolve_proto_node::hf79fd39504ca50ee@http://localhost:8080/wasm/pkg/graphite_wasm_bg.wasm:wasm-function[845]:0x515e37  graphite_wasm.wasm.alloc::vec::Vec<T,A>::extend_desugared::h196a807a42701346@http://localhost:8080/wasm/pkg/graphite_wasm_bg.wasm:wasm-function[3726]:0x959f6f  graphite_wasm.wasm.<alloc::vec::Vec<T> as alloc::vec::spec_from_iter_nested::SpecFromIterNested<T,I>>::from_iter::h77fe5584e10bd536@http://localhost:8080/wasm/pkg/graphite_wasm_bg.wasm:wasm-function[3352]:0x905834  graphite_wasm.wasm.graph_craft::document::NodeNetwork::into_proto_networks::h60f2e7a533f02e62@http://localhost:8080/wasm/pkg/graphite_wasm_bg.wasm:wasm-function[5341]:0xa8a039  graphite_wasm.wasm.graph_craft::graphene_compiler::Compiler::compile::h40d33cbe8b847349@http://localhost:8080/wasm/pkg/graphite_wasm_bg.wasm:wasm-function[8960]:0xc4d072  graphite_wasm.wasm.graph_craft::graphene_compiler::Compiler::compile_single::ha4f69dd49cd2bc4e@http://localhost:8080/wasm/pkg/graphite_wasm_bg.wasm:wasm-function[4390]:0x9df844  graphite_wasm.wasm.graphite_editor::node_graph_executor::NodeRuntime::update_network::{{closure}}::hbf25c4b5fa651069@http://localhost:8080/wasm/pkg/graphite_wasm_bg.wasm:wasm-function[505]:0x396640  graphite_wasm.wasm.graphite_editor::node_graph_executor::NodeRuntime::run::{{closure}}::h3923e9cc5727cf8e@http://localhost:8080/wasm/pkg/graphite_wasm_bg.wasm:wasm-function[351]:0x22705a  graphite_wasm.wasm.graphite_wasm::editor_api::poll_node_graph_evaluation::{{closure}}::h00648883bd3c6f2b@http://localhost:8080/wasm/pkg/graphite_wasm_bg.wasm:wasm-function[8816]:0xc3ed5e  ```"
2062,Fix alignment snapping not preserving aspect ratio when Shift is held,closed,https://github.com/GraphiteEditor/Graphite/pull/2062,0HyperCube,,,0,2024-10-21T09:10:59Z,2024-10-26T00:34:25Z,2024-10-26T00:34:23Z,,Sí,"<!-- Please reference any relevant issue number below, optionally with a ""Closes""/""Resolves""/""Fixes"" prefix -->    Closes #2061      Previously the alignment snapper did not respect diagonal constraints."
2061,Alignment snaps don't respect preserving aspect ratio,closed,https://github.com/GraphiteEditor/Graphite/issues/2061,0HyperCube,,0HyperCube,0,2024-10-21T08:07:35Z,2025-01-19T21:59:54Z,2024-10-26T00:34:24Z,Milestone 42,No,"When resizing with a constraint (e.g. preserve aspect ratio) in the select tool, alignment snaps don't respect the constraint if it is diagonal."
2060,Add node button in the Properties panel,closed,https://github.com/GraphiteEditor/Graphite/issues/2060,0HyperCube,Web,0HyperCube,0,2024-10-21T08:04:33Z,2025-01-19T22:02:41Z,2024-10-26T06:58:35Z,Milestone 42,No,"A button to 'add a node' should be added to the bottom of the properties panel. Upon clicking, the list of nodes will appear."
2059,Fix gradient render transforms with Vello,closed,https://github.com/GraphiteEditor/Graphite/pull/2059,0HyperCube,,,0,2024-10-20T19:35:36Z,2025-02-02T00:38:16Z,2024-10-26T00:12:25Z,,Sí,"<!-- Please reference any relevant issue number below, optionally with a ""Closes""/""Resolves""/""Fixes"" prefix -->    Closes #2034, closes #2008  "
2058,Add Path tool support for the Tab key swapping to dragging the opposite handle,closed,https://github.com/GraphiteEditor/Graphite/pull/2058,DaraghD,,,10,2024-10-20T17:33:25Z,2024-10-31T15:37:00Z,2024-10-30T09:48:20Z,,Sí,Unsure of naming of the function    Partially closes #1870  
2057,[Crash Report] Brush tool on top of shapes crashes,closed,https://github.com/GraphiteEditor/Graphite/issues/2057,DaraghD,"Good First Issue,Crash",adamgerhant,2,2024-10-19T20:45:59Z,2024-12-23T23:20:50Z,2024-10-25T23:54:38Z,Milestone 42,No,"**Describe the Crash**  Using brush tool ontop of stuff     **Steps To Reproduce**  Describe precisely how the crash occurred, step by step, starting with a new editor window.  1. Open a local build of graphite with debug assertions enabled.  2.  Delete the artboards (or create an infinite document).  3. Draw a with the brush tool.  4. Crash    **Additional Details**  Provide any further information or context that you think would be helpful in fixing the issue. Screenshots or video can be linked or attached to this issue.  [Screencast_20241019_214255.webm](https://github.com/user-attachments/assets/ad29b7a2-f159-42bd-82fb-01229c2770e7)  **Browser and OS**  Firefox 130, Arch Linux    **Stack Trace**  Copied from the crash dialog in the Graphite editor:    ```  panicked at editor/src/messages/portfolio/document/utility_types/document_metadata.rs:207:9:  LayerNodeIdentifier::ROOT_PARENT cannot be converted to NodeId    createPanicManager/<@http://localhost:8080/src/io-managers/panic.ts:9:24  callCallback@http://localhost:8080/src/wasm-communication/subscription-router.ts:25:17  handleJsMessage@http://localhost:8080/src/wasm-communication/subscription-router.ts:33:5  createEditor/handle<@http://localhost:8080/src/wasm-communication/editor.ts:21:19  __wbg_get_imports/imports.wbg.__wbg_call_5fb7c8066a4a4825/<@http://localhost:8080/wasm/pkg/graphite_wasm.js:2302:26  handleError@http://localhost:8080/wasm/pkg/graphite_wasm.js:334:18  __wbg_get_imports/imports.wbg.__wbg_call_5fb7c8066a4a4825@http://localhost:8080/wasm/pkg/graphite_wasm.js:2301:67  graphite_wasm.wasm.__wbg_call_5fb7c8066a4a4825 externref shim@http://localhost:8080/wasm/pkg/graphite_wasm_bg.wasm:wasm-function[25341]:0xf2de18  graphite_wasm.wasm.js_sys::Function::call2::h2987cf074cae0c1c@http://localhost:8080/wasm/pkg/graphite_wasm_bg.wasm:wasm-function[20861]:0xee8259  graphite_wasm.wasm.graphite_wasm::editor_api::EditorHandle::send_frontend_message_to_js::ha4d06d6e54353418@http://localhost:8080/wasm/pkg/graphite_wasm_bg.wasm:wasm-function[2547]:0x828688  graphite_wasm.wasm.std::thread::local::LocalKey<T>::with::hd61b91dd691f48fa@http://localhost:8080/wasm/pkg/graphite_wasm_bg.wasm:wasm-function[14604]:0xdefa3f  graphite_wasm.wasm.graphite_wasm::panic_hook::h030f010a04469e60@http://localhost:8080/wasm/pkg/graphite_wasm_bg.wasm:wasm-function[1485]:0x69d2a0  graphite_wasm.wasm.core::ops::function::Fn::call::h326de5e8a792cab9@http://localhost:8080/wasm/pkg/graphite_wasm_bg.wasm:wasm-function[31492]:0xf51280  graphite_wasm.wasm.std::panicking::rust_panic_with_hook::h2adea73e77f917f4@http://localhost:8080/wasm/pkg/graphite_wasm_bg.wasm:wasm-function[14510]:0xdeadf2  graphite_wasm.wasm.std::panicking::begin_panic_handler::{{closure}}::hdbd2e392ad02e052@http://localhost:8080/wasm/pkg/graphite_wasm_bg.wasm:wasm-function[16650]:0xe4fc5b  graphite_wasm.wasm.std::sys::backtrace::__rust_end_short_backtrace::h7d3184d23478fc66@http://localhost:8080/wasm/pkg/graphite_wasm_bg.wasm:wasm-function[31379]:0xf50e45  graphite_wasm.wasm.rust_begin_unwind@http://localhost:8080/wasm/pkg/graphite_wasm_bg.wasm:wasm-function[24150]:0xf21538  graphite_wasm.wasm.core::panicking::panic_fmt::h1bc190b9665013d3@http://localhost:8080/wasm/pkg/graphite_wasm_bg.wasm:wasm-function[24151]:0xf21565  graphite_wasm.wasm.graphite_editor::messages::portfolio::document::utility_types::document_metadata::DocumentMetadata::transform_to_viewport::he49d91589ade3208@http://localhost:8080/wasm/pkg/graphite_wasm_bg.wasm:wasm-function[7890]:0xbdc3a2  graphite_wasm.wasm.<graphite_editor::messages::tool::tool_messages::brush_tool::BrushToolFsmState as graphite_editor::messages::tool::utility_types::Fsm>::transition::h0ef21faf21cb9338@http://localhost:8080/wasm/pkg/graphite_wasm_bg.wasm:wasm-function[455]:0x33d132  graphite_wasm.wasm.graphite_editor::messages::tool::utility_types::Fsm::process_event::hb62f32080768d26d@http://localhost:8080/wasm/pkg/graphite_wasm_bg.wasm:wasm-function[4418]:0x9e43e6  graphite_wasm.wasm.<graphite_editor::messages::tool::tool_messages::brush_tool::BrushTool as graphite_editor::utility_traits::MessageHandler<graphite_editor::messages::tool::tool_message::ToolMessage,&mut graphite_editor::messages::tool::utility_types::ToolActionHandlerData>>::process_message::h1e106856f8443c03@http://localhost:8080/wasm/pkg/graphite_wasm_bg.wasm:wasm-function[3523]:0x92ccd9  graphite_wasm.wasm.<graphite_editor::messages::tool::tool_message_handler::ToolMessageHandler as graphite_editor::utility_traits::MessageHandler<graphite_editor::messages::tool::tool_message::ToolMessage,graphite_editor::messages::tool::tool_messa    ge_handler::ToolMessageData>>::process_message::h5a01f2f51f67f0b3@http://localhost:8080/wasm/pkg/graphite_wasm_bg.wasm:wasm-function[626]:0x4413a4  graphite_wasm.wasm.graphite_editor::dispatcher::Dispatcher::handle_message::h4472643b48920805@http://localhost:8080/wasm/pkg/graphite_wasm_bg.wasm:wasm-function[543]:0x3d01ac  graphite_wasm.wasm.graphite_editor::application::Editor::handle_message::h82d0aeb69e52fc8b@http://localhost:8080/wasm/pkg/graphite_wasm_bg.wasm:wasm-function[23515]:0xf190d5  graphite_wasm.wasm.std::thread::local::LocalKey<T>::with::h0b821da661c2c76f@http://localhost:8080/wasm/pkg/graphite_wasm_bg.wasm:wasm-function[5296]:0xa81e44  graphite_wasm.wasm.graphite_wasm::editor_api::EditorHandle::dispatch::h32227cb36385de82@http://localhost:8080/wasm/pkg/graphite_wasm_bg.wasm:wasm-function[8375]:0xc0ff4f  graphite_wasm.wasm.editorhandle_onMouseDown@http://localhost:8080/wasm/pkg/graphite_wasm_bg.wasm:wasm-function[8796]:0xc3b60d  onMouseDown@http://localhost:8080/wasm/pkg/graphite_wasm.js:725:14  onPointerDown@http://localhost:8080/src/io-managers/input.ts:116:21  action@http://localhost:8080/src/io-managers/input.ts:25:77  ```"
2056,Overlays don't render when switching documents,closed,https://github.com/GraphiteEditor/Graphite/issues/2056,0HyperCube,"Good First Issue,Paper Cut",adamgerhant,0,2024-10-19T19:30:03Z,2025-01-19T21:59:53Z,2024-10-25T23:54:39Z,Milestone 42,No,To reproduce:  - Open https://dev.graphite.rs/  - Create a new document with an artboard  - Create another new document with an artboard.  - Switch back to the first document  - Observe that the overlay for the artboard name is no longer there. This also applies to tools with overlays (e.g. the select tool doesn't have any overlays).  - Switch tools and observe that overlays return.
2055,Allow the Path tool to edit an upstream path even if there's a type conversion midway,closed,https://github.com/GraphiteEditor/Graphite/pull/2055,adamgerhant,,,3,2024-10-19T18:17:40Z,2024-10-26T18:39:50Z,2024-10-26T18:39:49Z,,Sí,"I changed the upstream traversal for the tools to only iterate over the same type so that modifications to the output of a Boolean were applied to the vector data after the operation, not an upstream path node. This was a hacky solution, and we need better support for selection which path node to modify. This can be done with dots in the layer panel. More information in comment above `existing_node_id`"
2053,feat: add control + j to create a closed line with path tool,closed,https://github.com/GraphiteEditor/Graphite/pull/2053,Ayush2k02,,,1,2024-10-18T06:46:43Z,2024-11-21T06:37:57Z,2024-11-21T06:37:57Z,,Sí,"<!-- Please reference any relevant issue number below, optionally with a ""Closes""/""Resolves""/""Fixes"" prefix -->    Closes #  <img width=""1108"" alt=""Screenshot 2024-10-18 at 12 13 54 PM"" src=""https://github.com/user-attachments/assets/381b54f5-f890-4552-b56f-5cca33ae9107"">    https://github.com/user-attachments/assets/5e00ae63-2b95-468c-a3b5-e1ecab09a902    "
2052,Fix Text tool clearing text when hitting Escape by changing it to commit the edit instead,closed,https://github.com/GraphiteEditor/Graphite/pull/2052,RyanRothweiler,,,0,2024-10-17T23:39:07Z,2024-10-26T01:12:55Z,2024-10-26T01:12:55Z,,Sí,Closes #2051     Text tool escape input now sends CommitText instead of abort.  
2051,"When editing text in the viewport, hitting Escape seems to delete all the text",closed,https://github.com/GraphiteEditor/Graphite/issues/2051,RyanRothweiler,,RyanRothweiler,0,2024-10-17T23:37:49Z,2024-12-23T23:20:30Z,2024-10-26T01:12:56Z,Milestone 42,No,"When editing text using the text tool, in the viewport, pressing Escape seems to delete the text and the text disappears.  Desired behavior is for the Escape button to function the same as rmb when using the text tool.    [Discord thread here.](https://discord.com/channels/731730685944922173/1288982713176690689)      "
2049,Allow multiple top output wires to come from layers,closed,https://github.com/GraphiteEditor/Graphite/pull/2049,adamgerhant,,,0,2024-10-17T00:26:20Z,2024-10-25T22:32:32Z,2024-10-25T22:32:31Z,,Sí,Closes #1886    Allows vector layers to be joined into a single layer if they are connected by the pen tool
2046,Allow the Fill and Stroke nodes to work on groups,closed,https://github.com/GraphiteEditor/Graphite/pull/2046,0HyperCube,,,0,2024-10-16T20:13:44Z,2024-10-16T23:07:01Z,2024-10-16T23:06:54Z,,Sí,"As requested by Keavon, it rather unintuitive works only on the direct children of a graphic group. Also the generics are a mess, I'm not really sure how they work."
2045,Fix brush tool broken by #2011,closed,https://github.com/GraphiteEditor/Graphite/pull/2045,0HyperCube,,,1,2024-10-16T19:55:26Z,2024-10-16T20:04:34Z,2024-10-16T20:04:33Z,,Sí,As broken by #2011.
2043,Improved node graph support for user created nodes,closed,https://github.com/GraphiteEditor/Graphite/issues/2043,adamgerhant,Design,adamgerhant,1,2024-10-16T19:37:08Z,2025-01-19T22:02:40Z,2024-11-12T22:27:43Z,Milestone 42,No,"It should be possible to select a group of nodes, and then ""group"" them into a single node with a network implementation of those nodes. It should also be possible to change the number, order, and names of inputs/outputs. It could also be useful to ""ungroup"" a node. Once #2042 is complete, it should also be possible to change the annotated types for the inputs. Improved tooltips described in #2069 should also be added."
2041,Selection direction difference,closed,https://github.com/GraphiteEditor/Graphite/issues/2041,runxel,Good First Issue,pratikagr,3,2024-10-16T18:41:25Z,2025-02-02T00:36:04Z,2025-01-26T06:34:38Z,Milestone 44,No,The selection direction should make a difference.  Usually in apps like these if you start a selection frame by dragging the mouse to the right it should only select objects that are fully inside of the selection frame. If the user drags to the left everything that is _touched_ by the selection frame should be selected.
2039,Bevel path node,closed,https://github.com/GraphiteEditor/Graphite/issues/2039,0HyperCube,,0HyperCube,0,2024-10-16T17:23:37Z,2025-01-19T22:02:40Z,2024-10-26T02:25:42Z,Milestone 42,No,Add a node to bevel some vector data.    For each point in a path that is connected to exactly 2 segments:  - Offset by the user specified amount into both segments and insert new points.  - Delete the original point.  - Connect the two new points with a straight line segment.    Not in scope:  - Cleaning up paths where bevels overlap.  - Beveling only particular points (possibly selected in the viewport by the user).  - Dealing with mesh paths (beyond ignoring points with >2 segments).  - Angle limit parameter  - Fillets or polyline fillets
2037,Editor getting stuck if I upload 6 Images together. Just drag and drop 6 Images together,closed,https://github.com/GraphiteEditor/Graphite/issues/2037,Rsk078,,,1,2024-10-16T05:53:13Z,2024-10-29T21:31:49Z,2024-10-29T21:31:49Z,,No,
2036,Fix crash from empty document with no artboards introduced in #2028,closed,https://github.com/GraphiteEditor/Graphite/pull/2036,0HyperCube,,,0,2024-10-14T15:56:21Z,2024-10-14T18:24:52Z,2024-10-14T18:24:52Z,,Sí,"<!-- Please reference any relevant issue number below, optionally with a ""Closes""/""Resolves""/""Fixes"" prefix -->    Closes #2035  "
2035,Having no artboard crashes the editor,closed,https://github.com/GraphiteEditor/Graphite/issues/2035,Keavon,Crash,0HyperCube,0,2024-10-14T07:02:09Z,2024-12-23T23:18:08Z,2024-10-14T18:24:52Z,Milestone 42,No,"Either:    1. Make a new document with the default artboard  2. Open the graph, select the artboard, and delete it    or:    1. Make a new document without an artboard by enabling ""Infinite Canvas""    It looks like this regression was introduced in #2028.    Crash log:    ```  panicked at editor/src/messages/portfolio/document/document_message_handler.rs:2235:9:  The parent targets should always be empty (since we have left all layers)    Error      at https://dev.graphite.rs/assets/index-DuUmgc5P.js:701:1169      at g (https://dev.graphite.rs/assets/index-DuUmgc5P.js:686:5194)      at Object.handleJsMessage (https://dev.graphite.rs/assets/index-DuUmgc5P.js:686:5342)      at https://dev.graphite.rs/assets/index-DuUmgc5P.js:687:66749      at https://dev.graphite.rs/assets/index-DuUmgc5P.js:687:39724      at rt (https://dev.graphite.rs/assets/index-DuUmgc5P.js:687:2062)      at R0.o.wbg.__wbg_call_5fb7c8066a4a4825 (https://dev.graphite.rs/assets/index-DuUmgc5P.js:687:39690)      at graphite_wasm.wasm._ZN13graphite_wasm10editor_api12EditorHandle27send_frontend_message_to_js17ha25fea14a03bc37dE (https://dev.graphite.rs/assets/graphite_wasm_bg-FAZobSHR.wasm:wasm-function[3460]:0x7a5f06)      at graphite_wasm.wasm._ZN4core3ops8function2Fn4call17h0b6e80a882797c3eE (https://dev.graphite.rs/assets/graphite_wasm_bg-FAZobSHR.wasm:wasm-function[12804]:0xa52b59)      at graphite_wasm.wasm._ZN3std9panicking20rust_panic_with_hook17h33fe77d38d305ca3E (https://dev.graphite.rs/assets/graphite_wasm_bg-FAZobSHR.wasm:wasm-function[6456]:0x930366)      at graphite_wasm.wasm._ZN4core9panicking9panic_fmt17hde8b7aa66e2831e1E (https://dev.graphite.rs/assets/graphite_wasm_bg-FAZobSHR.wasm:wasm-function[9756]:0xa0d88a)      at graphite_wasm.wasm._ZN146_$LT$graphite_editor..messages..portfolio..document..document_message_handler..ClickXRayIter$u20$as$u20$core..iter..traits..iterator..Iterator$GT$4next17hb7f34416b8af9d99E (https://dev.graphite.rs/assets/graphite_wasm_bg-FAZobSHR.wasm:wasm-function[688]:0x38aa6e)      at graphite_wasm.wasm._ZN15graphite_editor8messages9portfolio8document24document_message_handler22DocumentMessageHandler5click17h0ab727e21aa2c03aE (https://dev.graphite.rs/assets/graphite_wasm_bg-FAZobSHR.wasm:wasm-function[1778]:0x5e8892)      at graphite_wasm.wasm._ZN289_$LT$graphite_editor..messages..tool..tool_messages..select_tool..SelectTool$u20$as$u20$graphite_editor..utility_traits..MessageHandler$LT$graphite_editor..messages..tool..tool_message..ToolMessage$C$$RF$mut$u20$graphite_editor..messages..tool..utility_types..ToolActionHandlerData$GT$$GT$15process_message17h73ef76ac2ab60bf6E (https://dev.graphite.rs/assets/graphite_wasm_bg-FAZobSHR.wasm:wasm-function[2165]:0x670136)      at graphite_wasm.wasm._ZN280_$LT$graphite_editor..messages..tool..tool_message_handler..ToolMessageHandler$u20$as$u20$graphite_editor..utility_traits..MessageHandler$LT$graphite_editor..messages..tool..tool_message..ToolMessage$C$graphite_editor..messages..tool..tool_message_handler..ToolMessageData$GT$$GT$15process_message17h3c9a67c11d1a60aaE (https://dev.graphite.rs/assets/graphite_wasm_bg-FAZobSHR.wasm:wasm-function[408]:0x205f97)      at graphite_wasm.wasm._ZN15graphite_editor10dispatcher10Dispatcher14handle_message17h1ecc4f83899b780cE (https://dev.graphite.rs/assets/graphite_wasm_bg-FAZobSHR.wasm:wasm-function[441]:0x237227)      at graphite_wasm.wasm._ZN13graphite_wasm10editor_api12EditorHandle8dispatch17hd95fc3cf7142e92cE (https://dev.graphite.rs/assets/graphite_wasm_bg-FAZobSHR.wasm:wasm-function[4082]:0x827236)      at graphite_wasm.wasm.editorhandle_onKeyDown (https://dev.graphite.rs/assets/graphite_wasm_bg-FAZobSHR.wasm:wasm-function[6133]:0x915664)      at ga.onKeyDown (https://dev.graphite.rs/assets/index-DuUmgc5P.js:687:8016)      at g (https://dev.graphite.rs/assets/index-DuUmgc5P.js:690:2304)  ```"
2034,Layer transforms are broken in Changing Seasons demo art in Vello,closed,https://github.com/GraphiteEditor/Graphite/issues/2034,Keavon,,0HyperCube,0,2024-10-12T21:27:19Z,2025-02-02T00:38:43Z,2024-10-26T00:12:26Z,Milestone 42,No,
2033,Add math-parser library,closed,https://github.com/GraphiteEditor/Graphite/pull/2033,urisinger,,,6,2024-10-12T20:47:50Z,2024-12-23T23:08:34Z,2024-11-21T18:24:02Z,,Sí,Partly closes #2026    For more info check out the refenced issue.
2032,Improve text overlay styling and fix artboard label positioning bug,closed,https://github.com/GraphiteEditor/Graphite/pull/2032,0HyperCube,,,0,2024-10-12T19:17:51Z,2024-10-13T21:35:51Z,2024-10-13T21:35:50Z,,Sí,- Fix artboard name overlays being positioned incorrectly when the viewport is rotated and the artboard is not at the origin (they flew off)  - Improve legability of the snapping overlays.  - Restore padding around the measure overlays.
2031,Feature: Add a production container image to run it on own server.,closed,https://github.com/GraphiteEditor/Graphite/issues/2031,aleleba,,,2,2024-10-12T00:05:20Z,2025-01-18T13:13:57Z,2024-10-12T00:09:20Z,,No,"I do not know if there is on the plan, but should be great to have the oportunity to run the project inside a docker container or in podman, should be great to try to run it locally in an easy way.    It should be great to prepare on the CI/DC Pipeline the publishing of a new image on a container repo, so the comunity can run it locally.    Thank you in advance, also I can get some hands on to help you to acomplish this 👍🏼 "
2030,New node: Offset Path,closed,https://github.com/GraphiteEditor/Graphite/pull/2030,Keavon,,,0,2024-10-11T21:11:29Z,2024-10-11T21:50:55Z,2024-10-11T21:50:54Z,,Sí,(Also fixes a minor bug with the Assign Colors node which caused a black color to be assigned due to division by 0 when only one layer was present.)
2029,Fix Ctrl+H layer hiding and Ctrl+L layer locking only working with the graph open,closed,https://github.com/GraphiteEditor/Graphite/pull/2029,faisalill,,,5,2024-10-11T14:22:04Z,2024-10-14T04:38:00Z,2024-10-13T21:19:46Z,,Sí,## CLOSES  ![image](https://github.com/user-attachments/assets/ff5333fa-f3a2-427a-af7b-205ab12bef81)    
2028,Factor in artboard clipping to the click target x-ray function,closed,https://github.com/GraphiteEditor/Graphite/pull/2028,0HyperCube,,,1,2024-10-10T20:56:54Z,2024-10-12T23:38:18Z,2024-10-12T23:38:17Z,,Sí,As requested by @Keavon.    I chose to implement collecting the clipping artboards as part of collecting the metadata. If @adamgerhant wishes to redo this then they are welcome to.
2027,Update Wasm dependencies to fix WebGPU spec change crash in Firefox with Vello,closed,https://github.com/GraphiteEditor/Graphite/pull/2027,0HyperCube,,,1,2024-10-10T20:08:34Z,2024-10-12T21:28:41Z,2024-10-12T21:28:39Z,,Sí,"Fixes running on firefox nightly (requires the latest wgpu to fix https://github.com/gfx-rs/wgpu/issues/6290#issuecomment-2383605551). This also required using vello with the git wgpu version.    We get a warning due to ""use of deprecated method `web_sys::CanvasRenderingContext2d::set_stroke_style`"". There is an alternative function but it is broken. I fixed it in https://github.com/rustwasm/wasm-bindgen/pull/4170 but it has not been released. There will apparently be a patch release ""today""."
2025,Fix faulty contravariance checking,closed,https://github.com/GraphiteEditor/Graphite/pull/2025,TrueDoctor,,,0,2024-10-07T07:53:56Z,2024-10-07T19:35:29Z,2024-10-07T19:35:27Z,,Sí,"<!-- Please reference any relevant issue number below, optionally with a ""Closes""/""Resolves""/""Fixes"" prefix -->    Fix function contra variance checking by inverting call types and use concrete implementation for future type checks fixing a known unsoundness issue  "
