number,title,state,html_url,user,labels,assignee,comments,created_at,updated_at,closed_at,milestone,is_pull_request,body
2396,Fix quick measuring of skewed and rotated layers by using the viewport space AABB,closed,https://github.com/GraphiteEditor/Graphite/pull/2396,singhutsav5502,,,34,2025-03-07T16:06:22Z,2025-03-12T10:53:59Z,2025-03-12T10:53:59Z,,Sí,Make sure that quick measure overlays are based on AABBs drawn in the viewport local space.    Closes #1896 
2395,"Fix Path tool behavior with Shift-dragging an already selected point, where it wrongly got deselected",closed,https://github.com/GraphiteEditor/Graphite/pull/2395,singhutsav5502,,,14,2025-03-07T14:44:14Z,2025-04-17T09:57:57Z,2025-04-17T09:57:56Z,,Sí,Resolves https://discord.com/channels/731730685944922173/881073965047636018/1347408498211815434    Send Path_tool FSM to `Dragging` state on `MouseDown` if clicking an already selected point.  
2394,Add PTZ support for flipping the canvas,closed,https://github.com/GraphiteEditor/Graphite/pull/2394,Sidharth-Singh10,,,4,2025-03-07T09:33:04Z,2025-05-20T05:56:04Z,2025-05-18T06:16:00Z,,Sí,"<!-- Please reference any relevant issue number below, optionally with a ""Closes""/""Resolves""/""Fixes"" prefix -->  Closes #1722   "
2393,"Tidy up NodeNetworkInterface, replacing &[] root network arguments with methods for the document network",closed,https://github.com/GraphiteEditor/Graphite/pull/2393,Keavon,,,0,2025-03-07T09:13:43Z,2025-03-07T09:33:26Z,2025-03-07T09:33:24Z,,Sí,Resolves https://discord.com/channels/731730685944922173/881073965047636018/1341016532561690655
2392,Shallow Select mode fails to transfer selection to selected sibling,closed,https://github.com/GraphiteEditor/Graphite/issues/2392,Keavon,Good First Issue,mTvare6,1,2025-03-07T08:01:56Z,2025-05-02T21:26:48Z,2025-04-30T03:24:49Z,Milestone 47,No,"In the Select tool with *Shallow Select* mode set, I should be able to single-click the green shape in the viewport and transfer the selection to it, because it is the sibling of the already-selected layer. Currently it incorrectly selects the shared parent folder instead of the green shape's ""Boolean Operation"" layer if it's clicked. Clicking a layer within the same shared ancestor shouldn't return selection to being outside the scope of that shared ancestor.  ![Image](https://github.com/user-attachments/assets/f55a2d16-8aef-4149-bf10-c8f05eb22018)"
2390,Make the Pen tool show a path being closed by drawing a filled overlay when hovering the endpoint,closed,https://github.com/GraphiteEditor/Graphite/issues/2390,Keavon,Good First Issue,c-mateo,2,2025-03-07T07:47:25Z,2025-05-02T21:26:30Z,2025-04-24T01:34:12Z,Milestone 47,No,"Add a visual indicator when the Pen tool would close a path by showing a filled interior to the path (using the same translucent blue as we use for rectangular/lasso selection) when hovering over the endpoint that will make the shape become closed. This needs to work with any subpath out of potentially multiple. It doesn't yet have to work with mesh vector (enabled in the app preferences), but that would be a bonus."
2389,Recursive folder expand/collapse,closed,https://github.com/GraphiteEditor/Graphite/issues/2389,Keavon,"Good First Issue,Web,Paper Cut",0SlowPoke0,1,2025-03-07T07:24:35Z,2025-04-12T04:24:35Z,2025-03-10T21:01:01Z,Milestone 46,No,"The backend message for handling folder expansion and collapsing, triggered by clicking the arrow in the Layers panel frontend, should have a boolean flag added for whether it should occur recursively or normally. Holding <kbd>Alt</kbd> when clicking the arrow should be plumbed through from the frontend to tell the message if recursive should be used when that modified key is held down during the click. So this is mostly a backend task, but has a little web as well."
2388,Allow printing proto graph in graphite-cli,closed,https://github.com/GraphiteEditor/Graphite/pull/2388,bradrn,,,4,2025-03-07T06:33:33Z,2025-03-08T13:13:59Z,2025-03-08T13:13:58Z,,Sí,"As in the title. I see this change as being useful for debugging purposes. Additionally, since executing the node graph isn’t always needed, this adds another option `--no-run` to prevent this.    (This was previously discussed on the Discord server.)"
2387,Outline view mode doesn't always render with a consistent thickness,closed,https://github.com/GraphiteEditor/Graphite/issues/2387,Keavon,Good First Issue,EllenGYY,1,2025-03-07T05:14:14Z,2025-04-12T04:23:03Z,2025-03-10T10:29:54Z,Milestone 46,No,"Outline (aka wireframe) mode has the wrong stroke widths (see the Procedural String Lights demo art), causing many layers to be drawn much thicker than the 1px desired.  ![Image](https://github.com/user-attachments/assets/fca54bb3-0798-4129-a68f-a86d76faa493)  ![Image](https://github.com/user-attachments/assets/b16b31d2-595b-42f2-851f-ea2a1fdcb37d)"
2381,Clickable checkbox labels that toggle their associated checkbox,closed,https://github.com/GraphiteEditor/Graphite/issues/2381,Keavon,"Web,Paper Cut",,0,2025-03-07T02:41:48Z,2025-03-07T21:06:47Z,2025-03-07T17:33:15Z,,No,Labels with checkboxes should be clickable to make the checkbox change when clicking the text.  To be completed only by @Keavon.
2372,Select tool resizing with Shift held fails to preserve aspect ratio when snapping,closed,https://github.com/GraphiteEditor/Graphite/issues/2372,Keavon,"Help Wanted,Good First Issue",0HyperCube,0,2025-03-07T01:55:27Z,2025-04-12T04:08:11Z,2025-03-17T10:18:07Z,Milestone 46,No,"Copying from a thread in Discord that I've deleted in favor of filing this issue:  > **Keavon:** > Constraining aspect ratio (Shift while dragging to resize the corner of a layer) fails to actually preserve the aspect ratio if snapping is involved, allowing the layer to squish itself so it meets its snapping target.  > **0Hypercube:** > Keavon, if you can reproduce this, it would be useful to get some steps and also to know what snapper is being used (based on the text or the presence of alignment or distribution overlays).  > **Keavon:** > I tried reproducing it yesterday and didn't manage to, however it is an issue I have been noticing on multiple occasions recently so I will keep an eye on it and report back here as soon as I see it again. There must be something slightly nontrivial about the circumstances in which it has to be triggered.  > **Hypercube:** > Reproduce by holding shift and dragging the bottom left corner right. > >  https://github.com/user-attachments/assets/53f01900-1811-4f98-96f6-59c486c4b72c > > Reproduction [.graphite file](https://files.keavon.com/-/HappygoluckyInsecureJavalina/snapping_reproduction_1_.graphite)"
2371,Vello breaks colour picker,closed,https://github.com/GraphiteEditor/Graphite/issues/2371,0HyperCube,,,1,2025-03-06T21:10:48Z,2025-03-06T23:28:09Z,2025-03-06T21:11:42Z,,No,The colour picker / eyedropper tool doesn't work if the experimental vello mode is enabled. It simply picks black.
2370,Fix drawing with tilted viewport,closed,https://github.com/GraphiteEditor/Graphite/issues/2370,0HyperCube,"Paper Cut,Design",0HyperCube,0,2025-03-06T17:10:46Z,2025-04-12T04:22:40Z,2025-03-15T11:22:51Z,Milestone 46,No,"- Tilt the viewport - Draw a rectangle - Observe how the rectangle is aligned in document space rather than in viewport space  https://github.com/user-attachments/assets/d9842502-18a4-4e13-a66a-0fe871d0e9cf   Before #2286, viewport space was used.  We should decide on what UX is preferred."
2369,Fix document upgrades to work recursively within subgraph nodes,closed,https://github.com/GraphiteEditor/Graphite/pull/2369,TrueDoctor,,,0,2025-03-06T14:46:49Z,2025-03-06T15:42:59Z,2025-03-06T15:42:58Z,,Sí,"<!-- Please reference any relevant issue number below, optionally with a ""Closes""/""Resolves""/""Fixes"" prefix -->    "
2368,Move the Spline tool to a spline/path mode option in the Pen tool,closed,https://github.com/GraphiteEditor/Graphite/pull/2368,indierusty,,,14,2025-03-06T14:45:56Z,2025-05-02T01:55:33Z,2025-05-02T01:55:33Z,,Sí,
2367,Upgrade to the Rust 2024 edition,closed,https://github.com/GraphiteEditor/Graphite/pull/2367,TrueDoctor,,TrueDoctor,3,2025-03-05T23:47:33Z,2025-03-13T00:29:14Z,2025-03-13T00:29:13Z,,Sí,"<!-- Please reference any relevant issue number below, optionally with a ""Closes""/""Resolves""/""Fixes"" prefix -->    "
2366,Deleting an artboard doesn't update,closed,https://github.com/GraphiteEditor/Graphite/issues/2366,0HyperCube,Good First Issue,Keavon,3,2025-03-05T21:52:12Z,2025-04-12T04:21:56Z,2025-03-10T23:26:13Z,Milestone 46,No,To reproduce: - Create a new document with an artboard (checked by default in the new document dialogue) - Select the artboard in the layer tree - Press the <kbd>delete</kbd> key  Observe that the artboard is still displayed until the document is rerendered (e.g. by drawing a rectangle). This shouldn't happen.  Regression from #2265.
2365,fix(path-tool): disable colinear handles option for endpoints,closed,https://github.com/GraphiteEditor/Graphite/pull/2365,Sidharth-Singh10,,,2,2025-03-05T14:00:10Z,2025-03-06T07:24:47Z,2025-03-05T15:16:21Z,,Sí,"<!-- Please reference any relevant issue number below, optionally with a ""Closes""/""Resolves""/""Fixes"" prefix -->    fixes:https://discord.com/channels/731730685944922173/881073965047636018/1345303020136828958        https://github.com/user-attachments/assets/4b9a0aab-9775-4e8f-8fb6-47121141db83    "
2364,Restructure document upgrade code to fix upgrading sub networks,closed,https://github.com/GraphiteEditor/Graphite/pull/2364,TrueDoctor,,,0,2025-03-05T12:45:56Z,2025-03-06T14:43:03Z,2025-03-06T14:43:03Z,,Sí,"<!-- Please reference any relevant issue number below, optionally with a ""Closes""/""Resolves""/""Fixes"" prefix -->"
2363,Instance tables refactor part 5: unwrap GraphicGroup as multi-row Instance<GraphicElement> tables and move up transforms,closed,https://github.com/GraphiteEditor/Graphite/pull/2363,Keavon,,,1,2025-03-05T11:46:01Z,2025-06-07T07:55:31Z,2025-03-12T08:38:36Z,,Sí,"Part 5, partly closes #1834.    Discussion about squashing some bugs (for the record): https://discord.com/channels/731730685944922173/860830913390575646/1348437590914895893    # Issues    - [ ] All leaf nodes are incorrectly being grouped, with their transform and alpha blending being applied to that group instead of the direct leaf SVG element (deferred for after part 6 or 7)    - [ ] Fix for Vello as well (if necessary), and test Vello in general (deferred for after part 6 or 7)  - [x] Transform nodes mess up stroke transforms  - [x] Empty vectordata: there was a default empty vectordata in all groups.  - [x] Transforming a group with the tools resets the transform to identity.    We need to have an original transform when using tooling e.g. grs. We use `GraphOperationMessage::TransformSet` with the values stored in `OriginalTransforms`. This allows us to stop the transform being stuck at zero when the user drags the bounds through zero.    We also need a local transform for orientating the bounding box.  - [x] What is the original transform for a group?    If you apply a transform node to the left of a group, it actually just transforms all of the elements in the group.    If you apply a transform node above the group, it will also transform other layers which we don't want.        ![image](https://github.com/user-attachments/assets/bf9fdcfa-767f-4f37-a432-c4b3ee625cb8)  "
2362,Update Tauri to v2 and execute only the node graph in native,closed,https://github.com/GraphiteEditor/Graphite/pull/2362,TrueDoctor,,,2,2025-03-04T20:22:00Z,2025-04-14T11:43:16Z,2025-04-14T11:43:15Z,,Sí,"Closes #2536, closes #2546, closes #2537"
2361,Fix Vello rendering the infinite canvas without a white background color,closed,https://github.com/GraphiteEditor/Graphite/pull/2361,TrueDoctor,,,0,2025-03-04T20:20:05Z,2025-03-06T11:37:01Z,2025-03-06T11:37:00Z,,Sí,"<!-- Please reference any relevant issue number below, optionally with a ""Closes""/""Resolves""/""Fixes"" prefix -->    Change background fill color based on whether an artboard is present, note that this detection is currently broken in master since  #2265. Once that regression is fixed, vello and non-vello infinite canvas should work as expected    Closes #2006   "
2360,Fix perf regression from updating the hints bar every frame,closed,https://github.com/GraphiteEditor/Graphite/pull/2360,TrueDoctor,,,0,2025-03-04T18:20:43Z,2025-03-06T08:23:49Z,2025-03-06T08:23:47Z,,Sí,"<!-- Please reference any relevant issue number below, optionally with a ""Closes""/""Resolves""/""Fixes"" prefix -->    Fix performance regressions introduced in #2248   "
2359,Node Graph UX: improved discoverability through type-based suggestions,closed,https://github.com/GraphiteEditor/Graphite/issues/2359,leonardpauli,Web,singhutsav5502,1,2025-03-03T10:59:41Z,2025-04-12T04:19:05Z,2025-04-09T08:07:36Z,Milestone 47,No,"When dragging an output to an empty place on the canvas, we get the ""Search Nodes..."" pane to insert a connection. But most of these will be invalid, as they expect another type. In other node-n-noodles interfaces, like ComfyUI, the list is pre-filtered, or at least have expected ones, at the top, aiding discoverability of what you can do. Also, double click on empty place to bring up the ""Search Nodes..."" pane would also be great and expected!  <img width=""915"" alt=""Image"" src=""https://github.com/user-attachments/assets/371432d7-417e-4b38-aadc-b3a89e37de0d"" />"
2358,Enable free movement of transform cage edge during skew when Ctrl is held,closed,https://github.com/GraphiteEditor/Graphite/pull/2358,mTvare6,,,2,2025-03-03T09:58:32Z,2025-05-10T16:50:13Z,2025-03-06T11:57:02Z,,Sí,Fixes #2299  Follow-up to #2300
2353,Checkboxes clickable by their labels,closed,https://github.com/GraphiteEditor/Graphite/issues/2353,Keavon,"Web,Paper Cut",Keavon,0,2025-03-02T12:04:50Z,2025-06-04T10:03:17Z,2025-05-24T11:46:16Z,Milestone 48,No,Labels with checkboxes should be clickable to make the checkbox change when clicking the text.  To be completed only by @Keavon.
2339,"Disable the Path tool's ""Colinear Handles"" checkbox when no interior anchors are selected",closed,https://github.com/GraphiteEditor/Graphite/pull/2339,indierusty,,,6,2025-03-02T10:49:07Z,2025-03-12T20:50:42Z,2025-03-08T05:50:52Z,,Sí,Resolves https://discord.com/channels/731730685944922173/881073965047636018/1345303020136828958
2338,Fix Pen tool click-dragging from handle causing opposite colinear handle to rotate with drag,closed,https://github.com/GraphiteEditor/Graphite/pull/2338,indierusty,,,0,2025-03-02T07:03:42Z,2025-03-06T12:14:04Z,2025-03-06T12:14:03Z,,Sí,"<!-- Please reference any relevant issue number below, optionally with a ""Closes""/""Resolves""/""Fixes"" prefix -->  Fixes:  [The Pen tool rotates its prior segment handle when extending the path.](https://discord.com/channels/731730685944922173/881073965047636018/1345282144158875728)"
2337,Remove the old node macro,closed,https://github.com/GraphiteEditor/Graphite/issues/2337,Keavon,Graphene,Keavon,0,2025-03-02T01:04:16Z,2025-06-04T10:03:13Z,2025-05-18T04:24:33Z,Milestone 48,No,"Searching for `old_node_fn` returns only 5 usages. `brightness_contrast`/`brightness_contrast_legacy` will require some effort but it's not difficult, just work, to port to the new node macro. `map_image` won't be needed anymore once Brightness/Contrast are ported over. `extend_image_to_bounds` should be easy to replace with the modern node macro. The last usage is the Into node, which we'll have to see what @TrueDoctor says regarding that being ported over. Then after all that, the macro can be deleted. And possibly some other related code that it touches which would become unused?"
2334,"Fix wrong node parameter widgets, attempt 3 at #2323 ",closed,https://github.com/GraphiteEditor/Graphite/pull/2334,TrueDoctor,,,0,2025-03-01T14:14:07Z,2025-03-01T21:26:23Z,2025-03-01T21:26:21Z,,Sí,Replaces prior attempts e41471c088619474f275acae4da797ae8deba157 and #2323  
2333,Fix constrained snap when dragging by a compass rose axis and fix that axis line's jiggling,closed,https://github.com/GraphiteEditor/Graphite/pull/2333,mTvare6,,,9,2025-03-01T10:45:12Z,2025-05-10T16:50:17Z,2025-03-13T07:58:17Z,,Sí,Fixes #2313  Fixes [line banding]    [line banding]: https://discord.com/channels/731730685944922173/931942323644928040/1345339390809083934  
2331,Add a workaround to prevent nudge resizing from giving lines a NaN scale,closed,https://github.com/GraphiteEditor/Graphite/pull/2331,indierusty,,,2,2025-03-01T05:48:39Z,2025-03-01T07:18:02Z,2025-03-01T07:18:01Z,,Sí,Fixes https://discord.com/channels/731730685944922173/881073965047636018/1344535507635404902
2330,Consistant colours for axes ,closed,https://github.com/GraphiteEditor/Graphite/pull/2330,kuldeeprathore05,,,8,2025-02-28T18:02:00Z,2025-04-17T06:21:21Z,2025-04-17T06:21:21Z,,Sí,"<!-- Please reference any relevant issue number below, optionally with a ""Closes""/""Resolves""/""Fixes"" prefix -->    Closes #2311   ![Screenshot 2025-02-28 233034](https://github.com/user-attachments/assets/29869f5b-ff75-487a-92ae-8decf03c5024)    "
2329,Add the Select Parent command,closed,https://github.com/GraphiteEditor/Graphite/pull/2329,prathmesh703,,,2,2025-02-28T14:20:40Z,2025-03-01T04:58:09Z,2025-03-01T03:43:24Z,,Sí,"<!-- Please reference any relevant issue number below, optionally with a ""Closes""/""Resolves""/""Fixes"" prefix -->    Closes #2326     https://github.com/user-attachments/assets/d10efad0-603b-48e8-b509-12cd15f9cbdf      "
2328,Make Ctrl+D duplication interleave each layer like Alt+drag duplication already does,closed,https://github.com/GraphiteEditor/Graphite/pull/2328,4adex,,,2,2025-02-28T09:49:45Z,2025-03-01T07:44:13Z,2025-03-01T07:44:13Z,,Sí,"- Making the ordering of layers consistent when doing `Ctrl D`, or `Alt` drag.  https://discord.com/channels/731730685944922173/1344559420851490929/1344948509673132033"
2327,Fix several minor Pen and Path tool bugs,closed,https://github.com/GraphiteEditor/Graphite/pull/2327,0SlowPoke0,,,2,2025-02-28T07:08:14Z,2025-03-01T08:14:30Z,2025-03-01T08:14:30Z,,Sí,"- Fixes GRS scale-to-zero not updating overlays. [discord](https://discord.com/channels/731730685944922173/1319602515758682132/1338778114075136071)  - Fixes GRS affecting handles of multiple selected anchors. [discord](https://discord.com/channels/731730685944922173/881073965047636018/1341553854268837963)  - Prevents drawing the preview segment when connecting an anchor to itself. [discord](https://discord.com/channels/731730685944922173/881073965047636018/1340628699245973535)  - In the Path Tool, scaling colinear handles with different lengths could move both to the same side of the anchor. Since colinear handles must keep the anchor between them, this is now checked after scaling, disabling collinearity if violated.[discord](https://discord.com/channels/731730685944922173/881073965047636018/1340215814690963487)  - Fixed the issue where bending the handle from the starting point of the path should affect the primary handle, but it was broken.    https://github.com/user-attachments/assets/ce0d997e-d787-4d2b-97a7-0b79a424cc6e    "
2326,"Add a ""Select Parent"" command",closed,https://github.com/GraphiteEditor/Graphite/issues/2326,Keavon,Good First Issue,prathmesh703,2,2025-02-28T06:44:30Z,2025-03-02T00:44:35Z,2025-03-01T03:43:26Z,Milestone 45,No,"It should go under *Layer* > *Deselect All* (it can skip having an icon for now). For every selected layer, it should move the selection up a level in the hierarchy. Below are a couple before/after examples.  | Before | After | |--------|--------| | ![Image](https://github.com/user-attachments/assets/68edab81-ae9e-4b72-bd49-57981779d864) | ![Image](https://github.com/user-attachments/assets/6977c344-87e7-4f0a-b290-b08ed72005f2) | | ![Image](https://github.com/user-attachments/assets/56cf5e22-1988-4cb4-8ad0-7c7bdd2ad2b5) | ![Image](https://github.com/user-attachments/assets/eeb6740d-f2c8-46ee-936c-29fb298a5ce6) | "
2324,Fix duplicates not all being selected after Ctrl+D,closed,https://github.com/GraphiteEditor/Graphite/pull/2324,4adex,,,2,2025-02-28T05:28:30Z,2025-02-28T06:30:03Z,2025-02-28T06:29:27Z,,Sí,solved https://discord.com/channels/731730685944922173/881073965047636018/1344559420851490929  Intended behaviour as shown in the video    https://github.com/user-attachments/assets/6e7a880e-918b-4993-818f-75ef10b56556    
2323,Fix incorrect Properties panel widget types for proto nodes,closed,https://github.com/GraphiteEditor/Graphite/pull/2323,adamgerhant,,,0,2025-02-28T04:54:10Z,2025-02-28T05:22:04Z,2025-02-28T05:22:02Z,,Sí,The input type was previously being resolved from the protonode implementation instead of the compiled type.  
2322,Add feature for switching existing boolean ops to another type in the Select tool,closed,https://github.com/GraphiteEditor/Graphite/pull/2322,otdavies,,,0,2025-02-28T02:37:40Z,2025-02-28T05:39:22Z,2025-02-28T05:39:21Z,,Sí,https://github.com/user-attachments/assets/8aeb3aef-5c5f-4778-8f93-51541591826d    
2321,"Unable to set Polygon tool to other amounts of points, doing so crashes",closed,https://github.com/GraphiteEditor/Graphite/issues/2321,Human43215,Crash,Keavon,7,2025-02-27T23:09:14Z,2025-04-12T04:08:02Z,2025-03-02T21:11:19Z,Milestone 46,No," i was trying to make something **Steps To Reproduce** 1. Opened the Graphite editor at https://editor.graphite.rs 2. made a new project 3. used the rectangle tool to make a square 4.selected the polygon tool 5. changed the amount of sides for the polygon tool to six 6. made a polygon 7. clicked select tool 7. tried to grab polygon by using keyboard shortcut (pressed g) 8. crash occurred  **Additional Details** it appears that when the amount of sides on the polygon tool is altered it puts the software in a state where using any keyboard shortcuts causes a crash  **Browser and OS** Firefox 135, Windows 10  **Stack Trace** Copied from the crash dialog in the Graphite editor:  ``` panicked at editor/src/messages/layout/layout_message_handler.rs:268:59: PivotInput update was not of type: u64  wp/<@https://editor.graphite.rs/assets/index-4-pM0epr.js:898:1178 g@https://editor.graphite.rs/assets/index-4-pM0epr.js:884:63371 handleJsMessage@https://editor.graphite.rs/assets/index-4-pM0epr.js:884:63519 X2/e<@https://editor.graphite.rs/assets/index-4-pM0epr.js:884:63912 $2/o.wbg.__wbg_call_3b770f0d6eb4720e/<@https://editor.graphite.rs/assets/index-4-pM0epr.js:884:12372 Mt@https://editor.graphite.rs/assets/index-4-pM0epr.js:883:5835 $2/o.wbg.__wbg_call_3b770f0d6eb4720e@https://editor.graphite.rs/assets/index-4-pM0epr.js:884:12342 graphite_wasm.wasm._ZN13graphite_wasm10editor_api12EditorHandle27send_frontend_message_to_js17hede8fc66aef6ad3cE@https://editor.graphite.rs/assets/graphite_wasm_bg-DBmrMt-C.wasm:wasm-function[4021]:0x87a013 graphite_wasm.wasm._ZN4core3ops8function2Fn4call17ha2fcdffa052e1591E@https://editor.graphite.rs/assets/graphite_wasm_bg-DBmrMt-C.wasm:wasm-function[14073]:0xb3adbb graphite_wasm.wasm._ZN3std9panicking20rust_panic_with_hook17hb39abb160cd4038cE@https://editor.graphite.rs/assets/graphite_wasm_bg-DBmrMt-C.wasm:wasm-function[7596]:0xa43aae graphite_wasm.wasm._ZN4core9panicking9panic_fmt17h6f4dae69dcc1a6d2E@https://editor.graphite.rs/assets/graphite_wasm_bg-DBmrMt-C.wasm:wasm-function[11784]:0xb10f54 graphite_wasm.wasm._ZN4core6option13expect_failed17hada3d336a83d09a3E@https://editor.graphite.rs/assets/graphite_wasm_bg-DBmrMt-C.wasm:wasm-function[10268]:0xaea8e5 graphite_wasm.wasm._ZN15graphite_editor8messages6layout22layout_message_handler20LayoutMessageHandler22handle_widget_callback17h62fe36393facb700E@https://editor.graphite.rs/assets/graphite_wasm_bg-DBmrMt-C.wasm:wasm-function[477]:0x29f881 graphite_wasm.wasm._ZN15graphite_editor10dispatcher10Dispatcher14handle_message17hf31fb8dc968d0cc1E@https://editor.graphite.rs/assets/graphite_wasm_bg-DBmrMt-C.wasm:wasm-function[443]:0x2549d9 graphite_wasm.wasm._ZN3std6thread5local17LocalKey$LT$T$GT$4with17h4b6736da4c26b462E@https://editor.graphite.rs/assets/graphite_wasm_bg-DBmrMt-C.wasm:wasm-function[5794]:0x995c6c graphite_wasm.wasm._ZN13graphite_wasm10editor_api12EditorHandle19widget_value_update17hb76c8241c15aeca0E@https://editor.graphite.rs/assets/graphite_wasm_bg-DBmrMt-C.wasm:wasm-function[2712]:0x76edee graphite_wasm.wasm.editorhandle_widgetValueUpdate externref shim multivalue shim@https://editor.graphite.rs/assets/graphite_wasm_bg-DBmrMt-C.wasm:wasm-function[11785]:0xb11010 widgetValueUpdate@https://editor.graphite.rs/assets/index-4-pM0epr.js:884:3924 m@https://editor.graphite.rs/assets/index-4-pM0epr.js:932:57237 $_/se/<@https://editor.graphite.rs/assets/index-4-pM0epr.js:932:57744 i@https://editor.graphite.rs/assets/index-4-pM0epr.js:922:79405 se@https://editor.graphite.rs/assets/index-4-pM0epr.js:932:57752 s@https://editor.graphite.rs/assets/index-4-pM0epr.js:932:46968 Ut/</<@https://editor.graphite.rs/assets/index-4-pM0epr.js:17:966 Ut/<@https://editor.graphite.rs/assets/index-4-pM0epr.js:17:952 Q@https://editor.graphite.rs/assets/index-4-pM0epr.js:929:10828 K@https://editor.graphite.rs/assets/index-4-pM0epr.js:929:12108 ```"
2320,Make it easier to resize short/narrow edges of the transform cage without corners taking precedence,closed,https://github.com/GraphiteEditor/Graphite/pull/2320,mTvare6,,,2,2025-02-27T13:52:24Z,2025-05-10T16:50:09Z,2025-03-01T08:39:47Z,,Sí,Fixes https://discord.com/channels/731730685944922173/931942323644928040/1344594798404964364
2319,"Fix Spline tool so its merging endpoints with other layers happens immediately, not after canceling",closed,https://github.com/GraphiteEditor/Graphite/pull/2319,indierusty,,,2,2025-02-27T06:41:53Z,2025-02-27T10:53:56Z,2025-02-27T10:53:56Z,,Sí,"<!-- Please reference any relevant issue number below, optionally with a ""Closes""/""Resolves""/""Fixes"" prefix -->  closes #2184 "
